id,start_date,bad_data,p_over,cstatus,screened_out,screener_advanced_fee,screener_nonpayment,screener_nondelivery,screener_extortion,screener_overpayment,screener_banking,skill_advanced_search,skill_pdf,skill_spyware,skill_wiki,skill_cache,skill_phishing,name_walter,name_bruce,name_kyle,name_ralph,name_emily,name_rachel,name_paula,name_martha,name_tina,name_rose,name_adam,name_alan,banking,banking_money,banking_desc,banking_flag,nondelivery,nondelivery_money,nondelivery_desc,nondelivery_flag,advanced_fee,advanced_fee_money,advanced_fee_desc,advanced_fee_flag,nonpayment,nonpayment_money,nonpayment_desc,nonpayment_flag,extortion,extortion_money,extortion_desc,extortion_flag,overpayment,overpayment_money,overpayment_desc,overpayment_flag,scaleup_banking,scaleup_banking_flag,scaleup_banking_desc,scaleup_banking_desc_lost_money_dummy,scaleup_banking_desc_lost_money,scaleup_nondelivery,scaleup_nondelivery_flag,scaleup_nondeliver_money,scaleup_nondeliver_desc,scaleup_nonpayment,scaleup_nonpayment_flag,scaleup_nonpayment_money,scaleup_nonpayment_desc,scaleup_advanced_fee,scaleup_advanced_fee_flag,scaleup_advanced_fee_money,scaleup_advanced_fee_desc,scaleup_overpayment,scaleup_overpayment_flag,scaleup_overpayment_money,scaleup_overpayment_desc,scaleup_extortion,scaleup_extortion_flag,scaleup_extortion_money,scaleup_extortion_desc,visibility_overpayment,visibility_overpayment_count,visibility_overpayment_sureness,visibility_extortion,visibility_extortion_count,visibility_extortion_sureness,visibility_advanced_fee,visibility_advanced_fee_count,visibility_advanced_fee_sureness,visibility_nonpayment,visibility_nonpayment_count,visibility_nonpayment_sureness,visibility_nondelivery,visibility_nondelivery_count,visibility_nondelivery_sureness,visibility_banking,visibility_banking_count,visibility_banking_sureness,scaleup_nondelivery_money,scaleup_nondelivery_desc,wave,scaleup_banking_desc_lost_money_count,case_id,weight,weight2,qual,startdt,enddt,duration,surv_mode,surv_lang,device,gender,age,age4,age7,racethnicity,educ,marital,employ,income,state,region4,region9,metro,internet,housing,home_type,phoneservice,hhsize,hh01,hh25,hh612,hh1317,hh18ov,banking_lostmoney,scaleup_banking_confirmed,scaleup_banking_desc_lost_money_count_confirmed,scaleup_nondelivery_confirmed,scaleup_nonpayment_confirmed,scaleup_overpayment_confirmed,scaleup_extortion_confirmed,scaleup_advanced_fee_confirmed
Q1W5T0,2020-09-08T15:10:26Z,,2,2,inconsistent,No,No,No,No,Yes,,4,4,4,4,4,4,5,5,3,6,18,9,5,39,6,8,1,5,0,,,,0,,,,0,,,,0,,,,0,,,,0,,,,,,,,,,,,,,,,,,,,,,,,,,,,,,,,,,,,,,,,,,,,,,,,,7_27_2020,,21125,,0.225768183,2,9/8/20 17:10,9/8/20 17:13,0,2,1,Desktop,2,63,4,5,3,5,3,5,2,OH,2,3,1,1,2,2,1,1,0,0,0,0,1,0,0,0,0,0,0,0,0
W4E4G8,2020-09-08T13:14:52Z,,2,2,screener,No,No,No,No,No,No,,,,,,,,,,,,,,,,,,,0,,,,0,,,,0,,,,0,,,,0,,,,0,,,,,,,,,,,,,,,,,,,,,,,,,,,,,,,,,,,,,,,,,,,,,,,,,7_27_2020,,21158,,0.647214521,2,9/8/20 14:14,9/8/20 14:15,0,2,1,Desktop,1,78,4,7,5,3,5,5,4,IL,2,3,1,0,2,3,4,1,0,0,0,0,1,0,0,0,0,0,0,0,0
S4F9G4,2020-09-08T11:45:40Z,,2,2,screener,No,No,No,No,No,No,,,,,,,,,,,,,,,,,,,0,,,,0,,,,0,,,,0,,,,0,,,,0,,,,,,,,,,,,,,,,,,,,,,,,,,,,,,,,,,,,,,,,,,,,,,,,,7_27_2020,,10248,,4.111467256,2,9/8/20 10:45,9/8/20 10:46,0,2,1,Desktop,1,24,1,1,4,1,5,1,6,CA,4,9,1,1,2,1,4,6,0,0,0,6,4,0,0,0,0,0,0,0,0
K1X4E3,2020-09-08T11:05:20Z,,2,2,screener,No,No,No,No,No,No,,,,,,,,,,,,,,,,,,,0,,,,0,,,,0,,,,0,,,,0,,,,0,,,,,,,,,,,,,,,,,,,,,,,,,,,,,,,,,,,,,,,,,,,,,,,,,7_27_2020,,28462,,1.605450095,2,9/8/20 12:05,9/8/20 12:06,0,2,1,Desktop,2,32,2,2,1,2,3,2,11,WI,2,3,0,1,2,3,2,3,0,0,0,0,3,0,0,0,0,0,0,0,0
H1D3D1,2020-09-08T10:40:07Z,,2,2,screener,No,No,No,No,No,No,,,,,,,,,,,,,,,,,,,0,,,,0,,,,0,,,,0,,,,0,,,,0,,,,,,,,,,,,,,,,,,,,,,,,,,,,,,,,,,,,,,,,,,,,,,,,,7_27_2020,,23455,,0.537419487,2,9/8/20 11:39,9/8/20 11:40,0,2,1,Desktop,1,55,3,5,2,4,5,1,7,KS,2,4,1,1,1,1,4,1,0,0,0,0,1,0,0,0,0,0,0,0,0
Z6N3J7,2020-09-08T09:49:16Z,,2,2,screener,No,No,Yes,No,No,No,,,,,,,,,,,,,,,,,,,0,,,,0,,,,0,,,,0,,,,0,,,,0,,,,,,,,,,,,,,,,,,,,,,,,,,,,,,,,,,,,,,,,,,,,,,,,,7_27_2020,,9964,,0.523005476,2,9/8/20 8:49,9/8/20 8:51,0,2,1,Smartphone,2,30,2,2,5,3,1,1,12,NV,4,8,0,1,1,1,2,4,0,0,2,0,2,0,0,0,0,0,0,0,0
D4L7J8,2020-09-08T09:41:11Z,,2,2,screener,No,No,No,No,No,No,,,,,,,,,,,,,,,,,,,0,,,,0,,,,0,,,,0,,,,0,,,,0,,,,,,,,,,,,,,,,,,,,,,,,,,,,,,,,,,,,,,,,,,,,,,,,,7_27_2020,,19059,,0.196099645,2,9/8/20 10:40,9/8/20 10:43,0,2,1,Desktop,2,60,4,5,1,4,1,7,16,WI,2,3,0,1,1,1,3,6,0,0,0,0,1,0,0,0,0,0,0,0,0
F4A0E5,2020-09-08T06:32:40Z,,2,2,screener,No,No,No,No,No,Yes,,,,,,,,,,,,,,,,,,,0,,,,0,,,,0,,,,0,,,,0,,,,0,,,,,,,,,,,,,,,,,,,,,,,,,,,,,,,,,,,,,,,,,,,,,,,,,7_27_2020,,21407,,0.484589194,2,9/8/20 8:32,9/8/20 8:33,0,2,1,Smartphone,2,38,2,3,5,3,1,1,12,DE,3,5,1,1,1,1,4,5,0,1,2,0,2,0,0,0,0,0,0,0,0
L7I0G6,2020-09-07T22:38:37Z,,2,2,screener,No,No,Yes,No,No,No,,,,,,,,,,,,,,,,,,,0,,,,0,,,,0,,,,0,,,,0,,,,0,,,,,,,,,,,,,,,,,,,,,,,,,,,,,,,,,,,,,,,,,,,,,,,,,7_27_2020,,27874,,2.478786127,2,8/25/20 1:16,9/7/20 22:41,0,2,1,Smartphone,1,49,3,4,4,5,1,1,15,TX,3,7,1,1,2,3,4,6,0,0,0,0,6,0,0,0,0,0,0,0,0
R8Y5G2,2020-09-07T21:21:30Z,,2,2,screener,No,No,No,No,No,Yes,,,,,,,,,,,,,,,,,,,0,,,,0,,,,0,,,,0,,,,0,,,,0,,,,,,,,,,,,,,,,,,,,,,,,,,,,,,,,,,,,,,,,,,,,,,,,,7_27_2020,,22350,,0.408323378,2,9/7/20 17:21,9/7/20 17:22,0,2,1,Desktop,1,76,4,7,1,4,1,5,16,HI,4,9,1,1,1,3,4,2,0,0,0,0,2,0,0,0,0,0,0,0,0
X4O6D4,2020-09-07T20:15:05Z,,2,2,screener,No,No,No,No,No,No,,,,,,,,,,,,,,,,,,,0,,,,0,,,,0,,,,0,,,,0,,,,0,,,,,,,,,,,,,,,,,,,,,,,,,,,,,,,,,,,,,,,,,,,,,,,,,7_27_2020,,19911,,1.475289332,2,9/7/20 22:14,9/7/20 22:17,0,2,1,Desktop,1,60,4,5,1,2,3,6,7,DE,3,5,1,1,1,4,4,6,0,0,0,2,5,0,0,0,0,0,0,0,0
L4M2E2,2020-09-07T19:49:15Z,,2,2,screener,No,No,No,No,No,No,,,,,,,,,,,,,,,,,,,0,,,,0,,,,0,,,,0,,,,0,,,,0,,,,,,,,,,,,,,,,,,,,,,,,,,,,,,,,,,,,,,,,,,,,,,,,,7_27_2020,,31494,,0.247013235,2,9/7/20 20:48,9/7/20 20:50,1,2,1,Desktop,2,53,3,4,1,4,1,1,17,WI,2,3,0,1,1,1,2,3,0,0,0,0,3,0,0,0,0,0,0,0,0
I1N3T9,2020-09-07T15:30:37Z,,2,2,screener,No,No,No,No,No,No,,,,,,,,,,,,,,,,,,,0,,,,0,,,,0,,,,0,,,,0,,,,0,,,,,,,,,,,,,,,,,,,,,,,,,,,,,,,,,,,,,,,,,,,,,,,,,7_27_2020,,22014,,0.569492844,2,9/7/20 15:30,9/7/20 15:31,0,2,1,Smartphone,1,39,2,3,3,4,1,1,10,NM,4,8,1,1,1,1,4,2,0,0,0,0,2,0,0,0,0,0,0,0,0
D0T3Z2,2020-09-07T15:06:43Z,,2,2,screener,No,No,No,No,No,No,,,,,,,,,,,,,,,,,,,0,,,,0,,,,0,,,,0,,,,0,,,,0,,,,,,,,,,,,,,,,,,,,,,,,,,,,,,,,,,,,,,,,,,,,,,,,,7_27_2020,,25820,,1.540548895,2,9/7/20 17:06,9/7/20 17:07,0,2,1,Smartphone,1,35,2,3,1,4,1,1,17,FL,3,5,1,1,1,1,4,2,0,0,0,0,2,0,0,0,0,0,0,0,0
V9S7Y0,2020-09-07T12:24:31Z,,1,1,no,No,No,No,Yes,Yes,No,3,3,3,3,3,3,3,2,5,4,3,6,2,1,2,1,3,1,0,,,,1,100,Ordered then never shipped the. Website was shut down,Y,0,,,,0,,,,0,,,,0,,,,2,N,Not really,,1000,0,,,,1,N,0,Donâ€™t know,0,,,,0,,,,0,,,,,,,,,,,,,,,,,,,,,,,,,1,2247,1.739240102,4.125684165,1,9/7/20 13:24,9/7/20 13:34,0,2,1,Smartphone,1,34,2,2,1,2,1,1,10,WI,2,3,0,1,1,1,4,6,0,2,2,0,2,0,0,0,0,0,0,0,0
C8F8A6,2020-09-07T11:31:30Z,,2,2,screener,No,No,No,No,No,No,,,,,,,,,,,,,,,,,,,0,,,,0,,,,0,,,,0,,,,0,,,,0,,,,,,,,,,,,,,,,,,,,,,,,,,,,,,,,,,,,,,,,,,,,,,,,,7_27_2020,,7481,,2.571330709,2,8/5/20 16:33,9/7/20 12:35,0,2,1,Smartphone,2,32,2,2,2,2,5,7,5,LA,3,7,1,0,2,2,4,1,0,0,0,0,1,0,0,0,0,0,0,0,0
H6T2V2,2020-09-07T10:27:15Z,,2,2,screener,No,No,No,No,No,No,,,,,,,,,,,,,,,,,,,0,,,,0,,,,0,,,,0,,,,0,,,,0,,,,,,,,,,,,,,,,,,,,,,,,,,,,,,,,,,,,,,,,,,,,,,,,,7_27_2020,,27667,,0.353615606,2,9/7/20 12:26,9/7/20 12:28,0,2,1,Tablet,2,61,4,5,2,4,5,1,9,MD,3,5,1,1,2,3,3,1,0,0,0,0,1,0,0,0,0,0,0,0,0
Z3Y2T5,2020-09-07T08:45:27Z,,1,1,no,No,No,No,,,No,3,2,3,1,2,2,1,0,0,0,1,0,0,0,1,0,0,21,0,,,,0,,,,0,,,,0,,,,0,,,,0,,,,0,,,,,0,,,,0,,,,0,,,,0,,,,0,,,,,,,,,,,,,,,,,,,,,,,,,,1208,0.138021516,0.278981655,1,8/27/20 13:32,9/7/20 10:53,1,2,1,Smartphone,2,68,4,6,1,3,4,5,4,PA,1,2,1,1,2,3,2,1,0,0,0,0,1,0,0,0,0,0,0,0,0
U4V1U0,2020-09-07T07:53:22Z,,2,2,screener,No,No,No,No,No,No,,,,,,,,,,,,,,,,,,,0,,,,0,,,,0,,,,0,,,,0,,,,0,,,,,,,,,,,,,,,,,,,,,,,,,,,,,,,,,,,,,,,,,,,,,,,,,7_27_2020,,22492,,0.499258128,2,9/7/20 8:53,9/7/20 8:54,0,2,1,Smartphone,2,49,3,4,1,5,1,1,13,MO,2,4,1,1,1,1,4,4,0,0,0,1,3,0,0,0,0,0,0,0,0
A8G0X4,2020-09-07T07:41:24Z,,2,2,inconsistent,No,Yes,No,No,No,No,3,5,5,3,4,4,1,1,1,1,2,0,1,1,1,1,2,2,0,,,,0,,,,0,,,,0,,,,0,,,,0,,,,,,,,,,,,,,,,,,,,,,,,,,,,,,,,,,,,,,,,,,,,,,,,,7_27_2020,,20088,,0.493985253,2,9/7/20 9:41,9/7/20 9:44,0,2,1,Smartphone,2,65,4,6,1,3,3,1,8,OH,2,3,1,1,1,1,4,1,0,0,0,0,1,0,0,0,0,0,0,0,0
E7W6E1,2020-09-07T02:32:12Z,,2,2,screener,No,No,No,No,No,No,,,,,,,,,,,,,,,,,,,0,,,,0,,,,0,,,,0,,,,0,,,,0,,,,,,,,,,,,,,,,,,,,,,,,,,,,,,,,,,,,,,,,,,,,,,,,,7_27_2020,,31038,,1.763854244,2,9/7/20 4:32,9/7/20 4:33,0,2,1,Smartphone,2,60,4,5,2,2,1,6,9,NY,1,2,1,1,2,3,2,4,0,0,0,0,2,0,0,0,0,0,0,0,0
N7Y9G1,2020-09-06T23:05:41Z,,2,2,screener,No,No,No,No,No,No,,,,,,,,,,,,,,,,,,,0,,,,0,,,,0,,,,0,,,,0,,,,0,,,,,,,,,,,,,,,,,,,,,,,,,,,,,,,,,,,,,,,,,,,,,,,,,7_27_2020,,12256,,1.247972465,2,9/6/20 21:05,9/6/20 21:06,0,2,1,Smartphone,2,22,1,1,1,3,1,7,6,AK,4,9,1,1,2,2,4,2,0,0,0,0,2,0,0,0,0,0,0,0,0
D1J6M1,2020-09-06T21:47:09Z,,2,2,inconsistent,No,Yes,No,No,No,No,5,5,5,5,5,5,0,0,0,0,1,0,0,0,0,0,0,0,0,,,,0,,,,0,,,,0,,,,0,,,,0,,,,,,,,,,,,,,,,,,,,,,,,,,,,,,,,,,,,,,,,,,,,,,,,,7_27_2020,,17487,,1.187041343,2,9/6/20 23:46,9/6/20 23:51,0,2,1,Smartphone,2,36,2,3,1,4,1,2,16,FL,3,5,1,1,1,1,4,6,0,2,2,0,2,0,0,0,0,0,0,0,0
P5J5J2,2020-09-06T21:26:18Z,,2,2,screener,No,No,Yes,No,No,No,,,,,,,,,,,,,,,,,,,0,,,,0,,,,0,,,,0,,,,0,,,,0,,,,,,,,,,,,,,,,,,,,,,,,,,,,,,,,,,,,,,,,,,,,,,,,,7_27_2020,,24752,,1.395719846,2,9/6/20 23:26,9/6/20 23:27,0,2,1,Desktop,1,51,3,4,2,3,1,1,11,NJ,1,2,1,1,2,3,4,3,0,0,0,0,3,0,0,0,0,0,0,0,0
J4Z9I8,2020-09-06T20:40:43Z,,2,2,screener,,No,No,No,,,,,,,,,,,,,,,,,,,,,0,,,,0,,,,0,,,,0,,,,0,,,,0,,,,,,,,,,,,,,,,,,,,,,,,,,,,,,,,,,,,,,,,,,,,,,,,,7_27_2020,,4799,,0.587756771,2,9/6/20 19:40,9/6/20 19:41,0,2,1,Smartphone,2,45,3,4,1,3,3,1,2,CA,4,9,1,0,2,1,4,1,0,0,0,0,1,0,0,0,0,0,0,0,0
N3S2H2,2020-09-06T19:51:57Z,,2,2,screener,No,No,No,No,No,No,,,,,,,,,,,,,,,,,,,0,,,,0,,,,0,,,,0,,,,0,,,,0,,,,,,,,,,,,,,,,,,,,,,,,,,,,,,,,,,,,,,,,,,,,,,,,,7_27_2020,,18371,,0.906814256,2,9/6/20 21:51,9/6/20 21:52,0,2,1,Desktop,2,45,3,4,1,5,5,2,13,MD,3,5,1,1,2,3,4,1,0,0,0,0,1,0,0,0,0,0,0,0,0
E9B0C1,2020-09-06T19:12:49Z,,2,2,screener,No,No,No,No,No,No,,,,,,,,,,,,,,,,,,,0,,,,0,,,,0,,,,0,,,,0,,,,0,,,,,,,,,,,,,,,,,,,,,,,,,,,,,,,,,,,,,,,,,,,,,,,,,7_27_2020,,25734,,0.764038936,2,9/6/20 21:12,9/6/20 21:13,0,2,1,Smartphone,2,36,2,3,1,4,1,1,18,MI,2,3,1,1,1,1,4,3,0,1,0,0,2,0,0,0,0,0,0,0,0
R3N8K4,2020-09-06T19:09:15Z,,2,2,screener,No,No,No,No,No,No,,,,,,,,,,,,,,,,,,,0,,,,0,,,,0,,,,0,,,,0,,,,0,,,,,,,,,,,,,,,,,,,,,,,,,,,,,,,,,,,,,,,,,,,,,,,,,7_27_2020,,13403,,0.58347679,2,9/6/20 18:08,9/6/20 18:55,1,2,1,Smartphone,2,57,3,5,1,3,3,1,9,WA,4,9,1,1,2,1,4,2,0,0,0,0,2,0,0,0,0,0,0,0,0
W8H8C0,2020-09-06T18:59:14Z,,2,2,screener,No,No,No,No,No,No,,,,,,,,,,,,,,,,,,,0,,,,0,,,,0,,,,0,,,,0,,,,0,,,,,,,,,,,,,,,,,,,,,,,,,,,,,,,,,,,,,,,,,,,,,,,,,7_27_2020,,28924,,0.541153145,2,9/6/20 19:58,9/6/20 20:00,0,2,1,Desktop,2,60,4,5,3,3,1,1,6,LA,3,7,1,0,1,1,1,4,0,0,0,0,4,0,0,0,0,0,0,0,0
H0B0J5,2020-09-06T18:36:41Z,,2,2,screener,No,No,No,No,No,No,,,,,,,,,,,,,,,,,,,0,,,,0,,,,0,,,,0,,,,0,,,,0,,,,,,,,,,,,,,,,,,,,,,,,,,,,,,,,,,,,,,,,,,,,,,,,,7_27_2020,,28120,,0.233976656,2,9/6/20 19:36,9/6/20 19:37,0,2,1,Smartphone,2,58,3,5,1,3,1,1,14,IL,2,3,1,1,1,1,4,2,0,0,0,0,2,0,0,0,0,0,0,0,0
C8X3Z4,2020-09-06T15:52:01Z,,2,2,screener,No,No,No,No,No,No,,,,,,,,,,,,,,,,,,,0,,,,0,,,,0,,,,0,,,,0,,,,0,,,,,,,,,,,,,,,,,,,,,,,,,,,,,,,,,,,,,,,,,,,,,,,,,7_27_2020,,13686,,5.966468702,2,9/6/20 17:51,9/6/20 17:52,0,2,1,Desktop,2,19,1,1,1,1,6,1,4,MI,2,3,0,1,1,1,2,4,0,0,0,0,4,0,0,0,0,0,0,0,0
A8C0X0,2020-09-06T15:09:13Z,,2,2,screener,No,No,No,No,No,Yes,,,,,,,,,,,,,,,,,,,0,,,,0,,,,0,,,,0,,,,0,,,,0,,,,,,,,,,,,,,,,,,,,,,,,,,,,,,,,,,,,,,,,,,,,,,,,,7_27_2020,,31383,,0.869943168,2,9/6/20 17:09,9/6/20 17:10,0,2,1,Smartphone,2,49,3,4,1,3,2,6,7,MI,2,3,0,1,1,1,2,4,0,0,0,2,2,0,0,0,0,0,0,0,0
G9I0C7,2020-09-06T14:55:39Z,,2,2,screener,No,No,No,No,No,Yes,,,,,,,,,,,,,,,,,,,0,,,,0,,,,0,,,,0,,,,0,,,,0,,,,,,,,,,,,,,,,,,,,,,,,,,,,,,,,,,,,,,,,,,,,,,,,,7_27_2020,,28453,,1.149515447,2,9/6/20 15:55,9/6/20 15:56,0,2,1,Smartphone,2,46,3,4,4,5,1,2,8,TX,3,7,1,1,1,1,2,3,0,0,0,0,3,0,0,0,0,0,0,0,0
E5V1F5,2020-09-06T14:51:16Z,,2,2,screener,No,No,No,No,No,No,,,,,,,,,,,,,,,,,,,0,,,,0,,,,0,,,,0,,,,0,,,,0,,,,,,,,,,,,,,,,,,,,,,,,,,,,,,,,,,,,,,,,,,,,,,,,,7_27_2020,,25122,,0.539406775,2,9/6/20 16:51,9/6/20 16:52,0,2,1,Smartphone,2,60,4,5,1,4,3,1,12,NJ,1,2,1,1,1,2,2,2,0,0,0,0,2,0,0,0,0,0,0,0,0
R7Y4H8,2020-09-06T12:17:42Z,,2,2,screener,No,No,Yes,No,No,No,,,,,,,,,,,,,,,,,,,0,,,,0,,,,0,,,,0,,,,0,,,,0,,,,,,,,,,,,,,,,,,,,,,,,,,,,,,,,,,,,,,,,,,,,,,,,,7_27_2020,,19777,,1.025867178,2,9/6/20 12:17,9/6/20 12:18,0,2,1,Desktop,1,41,2,3,1,4,6,2,12,CO,4,8,1,1,2,1,2,2,0,0,0,0,2,0,0,0,0,0,0,0,0
F6H4C6,2020-09-06T11:33:14Z,,1,1,no,No,No,No,No,No,No,5,4,3,3,3,3,1,0,2,1,0,2,0,0,1,0,1,1,0,,,,0,,,,0,,,,0,,,,0,,,,0,,,,0,,,,,0,,,,0,,,,0,,,,0,,,,0,,,,,,,,,,,,,,,,,,,,,,,,,,2789,0.648792981,2.021408775,1,9/6/20 13:33,9/6/20 13:36,0,2,1,Smartphone,1,20,1,1,2,3,5,1,1,MI,2,3,1,1,3,1,4,1,0,0,0,0,1,0,0,0,0,0,0,0,0
T4J0V2,2020-09-06T11:12:08Z,,2,2,screener,No,No,,No,No,No,,,,,,,,,,,,,,,,,,,0,,,,0,,,,0,,,,0,,,,0,,,,0,,,,,,,,,,,,,,,,,,,,,,,,,,,,,,,,,,,,,,,,,,,,,,,,,7_27_2020,,19994,,0.965057196,2,9/6/20 12:11,9/6/20 12:13,1,2,1,Smartphone,2,35,2,3,1,3,6,1,5,TX,3,7,0,1,2,1,4,6,0,2,0,0,4,0,0,0,0,0,0,0,0
S3H5K4,2020-09-06T10:07:35Z,,2,2,screener,No,No,No,No,No,No,,,,,,,,,,,,,,,,,,,0,,,,0,,,,0,,,,0,,,,0,,,,0,,,,,,,,,,,,,,,,,,,,,,,,,,,,,,,,,,,,,,,,,,,,,,,,,7_27_2020,,15855,,0.247013235,2,9/6/20 11:07,9/6/20 11:09,0,2,1,Desktop,2,55,3,5,1,4,2,1,13,WI,2,3,0,1,1,1,3,3,0,0,0,1,2,0,0,0,0,0,0,0,0
K7K9R8,2020-09-06T09:26:19Z,,2,2,screener,No,No,No,No,No,No,,,,,,,,,,,,,,,,,,,0,,,,0,,,,0,,,,0,,,,0,,,,0,,,,,,,,,,,,,,,,,,,,,,,,,,,,,,,,,,,,,,,,,,,,,,,,,7_27_2020,,27039,,0.230100897,2,9/6/20 11:26,9/6/20 11:27,0,2,1,Desktop,2,59,3,5,1,5,1,1,13,MI,2,3,0,1,1,1,4,2,0,0,0,0,2,0,0,0,0,0,0,0,0
T5P9A1,2020-09-06T08:34:53Z,,2,2,screener,No,No,No,No,No,No,,,,,,,,,,,,,,,,,,,0,,,,0,,,,0,,,,0,,,,0,,,,0,,,,,,,,,,,,,,,,,,,,,,,,,,,,,,,,,,,,,,,,,,,,,,,,,7_27_2020,,25140,,0.585987206,2,9/6/20 9:34,9/6/20 9:35,0,2,1,Desktop,2,72,4,6,1,3,3,2,7,WI,2,3,1,1,1,1,2,1,0,0,0,0,1,0,0,0,0,0,0,0,0
L0K6W4,2020-09-06T08:25:16Z,,2,2,screener,No,No,No,No,No,No,,,,,,,,,,,,,,,,,,,0,,,,0,,,,0,,,,0,,,,0,,,,0,,,,,,,,,,,,,,,,,,,,,,,,,,,,,,,,,,,,,,,,,,,,,,,,,7_27_2020,,19127,,1.932711444,2,9/6/20 9:24,9/6/20 9:27,0,2,1,Smartphone,2,42,2,3,1,2,1,7,12,WI,2,3,0,1,1,1,4,6,0,1,1,4,2,0,0,0,0,0,0,0,0
N5D3B7,2020-09-06T08:10:54Z,,2,2,screener,No,No,No,No,No,Yes,,,,,,,,,,,,,,,,,,,0,,,,0,,,,0,,,,0,,,,0,,,,0,,,,,,,,,,,,,,,,,,,,,,,,,,,,,,,,,,,,,,,,,,,,,,,,,7_27_2020,,21838,,0.513504353,2,9/6/20 10:10,9/6/20 10:12,0,2,1,Tablet,2,53,3,4,1,5,1,1,18,MI,2,3,1,1,1,1,4,3,0,0,0,0,3,0,0,0,0,0,0,0,0
K8B5K8,2020-09-06T07:58:12Z,,2,2,screener,No,No,No,No,No,No,,,,,,,,,,,,,,,,,,,0,,,,0,,,,0,,,,0,,,,0,,,,0,,,,,,,,,,,,,,,,,,,,,,,,,,,,,,,,,,,,,,,,,,,,,,,,,7_27_2020,,17879,,0.707166445,2,9/3/20 10:08,9/6/20 8:58,0,2,1,Smartphone,2,50,3,4,2,4,5,1,10,TX,3,7,1,1,2,3,4,3,0,0,0,0,3,0,0,0,0,0,0,0,0
P4N3F5,2020-09-06T07:43:35Z,,2,2,screener,No,No,No,No,No,No,,,,,,,,,,,,,,,,,,,0,,,,0,,,,0,,,,0,,,,0,,,,0,,,,,,,,,,,,,,,,,,,,,,,,,,,,,,,,,,,,,,,,,,,,,,,,,7_27_2020,,18708,,1.503701607,2,9/6/20 8:43,9/6/20 8:44,0,2,1,Desktop,2,39,2,3,1,2,1,1,10,KS,2,4,0,1,1,1,2,4,0,0,0,0,1,0,0,0,0,0,0,0,0
T6P0A5,2020-09-06T07:25:20Z,,2,2,screener,No,No,No,No,No,No,,,,,,,,,,,,,,,,,,,0,,,,0,,,,0,,,,0,,,,0,,,,0,,,,,,,,,,,,,,,,,,,,,,,,,,,,,,,,,,,,,,,,,,,,,,,,,7_27_2020,,17573,,0.691544108,2,9/6/20 8:24,9/6/20 8:26,1,2,1,Desktop,2,28,1,2,1,4,5,4,11,WI,2,3,1,1,1,1,2,5,0,0,0,0,5,0,0,0,0,0,0,0,0
C9K8F8,2020-09-06T06:52:39Z,,2,2,screener,No,No,No,No,No,Yes,,,,,,,,,,,,,,,,,,,0,,,,0,,,,0,,,,0,,,,0,,,,0,,,,,,,,,,,,,,,,,,,,,,,,,,,,,,,,,,,,,,,,,,,,,,,,,7_27_2020,,24338,,0.601423501,2,9/6/20 8:52,9/6/20 8:53,0,2,1,Smartphone,2,63,4,5,1,4,1,1,12,PA,1,2,1,1,1,2,4,2,0,0,0,0,1,0,0,0,0,0,0,0,0
L8C3L0,2020-09-06T05:33:48Z,,2,2,screener,No,No,No,No,No,No,,,,,,,,,,,,,,,,,,,0,,,,0,,,,0,,,,0,,,,0,,,,0,,,,,,,,,,,,,,,,,,,,,,,,,,,,,,,,,,,,,,,,,,,,,,,,,7_27_2020,,21531,,0.409156873,2,8/21/20 7:44,9/6/20 7:34,0,2,1,Desktop,1,70,4,6,1,3,1,5,8,NH,1,1,0,1,1,1,3,2,0,0,0,0,2,0,0,0,0,0,0,0,0
T8J4N4,2020-09-06T04:30:41Z,,2,2,inconsistent,,No,No,No,Yes,No,5,5,2,2,2,5,1,1,1,1,1,0,0,1,1,1,1,1,0,,,,0,,,,0,,,,0,,,,0,,,,0,,,,,,,,,,,,,,,,,,,,,,,,,,,,,,,,,,,,,,,,,,,,,,,,,7_27_2020,,20689,,0.799989371,2,9/6/20 6:29,9/6/20 6:32,0,2,1,Smartphone,2,40,2,3,4,5,5,1,15,NJ,1,2,1,1,1,3,2,3,0,0,0,0,3,0,0,0,0,0,0,0,0
B0V5J0,2020-09-06T03:16:59Z,,2,2,screener,No,No,No,No,No,Yes,,,,,,,,,,,,,,,,,,,0,,,,0,,,,0,,,,0,,,,0,,,,0,,,,,,,,,,,,,,,,,,,,,,,,,,,,,,,,,,,,,,,,,,,,,,,,,7_27_2020,,19025,,0.964457406,2,9/6/20 5:16,9/6/20 5:18,1,2,1,Tablet,2,54,3,4,1,2,1,1,14,NJ,1,2,1,1,1,2,2,6,0,0,0,1,12,0,0,0,0,0,0,0,0
O4E2W8,2020-09-06T01:39:29Z,,2,2,screener,No,No,Yes,No,No,No,,,,,,,,,,,,,,,,,,,0,,,,0,,,,0,,,,0,,,,0,,,,0,,,,,,,,,,,,,,,,,,,,,,,,,,,,,,,,,,,,,,,,,,,,,,,,,7_27_2020,,11084,,1.602100972,2,9/6/20 0:39,9/6/20 0:40,0,2,1,Smartphone,2,27,1,2,4,3,1,1,11,CA,4,9,1,0,1,1,2,6,0,1,0,0,5,0,0,0,0,0,0,0,0
U9M2Q9,2020-09-05T22:52:04Z,,2,2,inconsistent,No,Yes,No,No,No,Yes,5,5,3,2,1,5,0,1,1,0,0,2,1,0,1,1,0,2,0,,,,0,,,,0,,,,0,,,,0,,,,0,,,,,,,,,,,,,,,,,,,,,,,,,,,,,,,,,,,,,,,,,,,,,,,,,7_27_2020,,29054,,0.871926425,2,9/5/20 21:52,9/5/20 21:55,0,2,1,Desktop,2,55,3,5,4,3,4,6,11,CA,4,9,1,1,1,1,4,2,0,0,0,0,2,0,0,0,0,0,0,0,0
Z1J0O8,2020-09-05T20:54:06Z,,2,2,screener,No,No,No,No,No,No,,,,,,,,,,,,,,,,,,,0,,,,0,,,,0,,,,0,,,,0,,,,0,,,,,,,,,,,,,,,,,,,,,,,,,,,,,,,,,,,,,,,,,,,,,,,,,7_27_2020,,20280,,0.896966516,2,9/5/20 19:54,9/5/20 19:55,0,2,1,Smartphone,2,38,2,3,1,5,1,1,13,WA,4,9,1,1,1,1,4,2,0,0,0,0,1,0,0,0,0,0,0,0,0
L4Z1P9,2020-09-05T20:32:32Z,,2,2,screener,No,No,No,No,No,No,,,,,,,,,,,,,,,,,,,0,,,,0,,,,0,,,,0,,,,0,,,,0,,,,,,,,,,,,,,,,,,,,,,,,,,,,,,,,,,,,,,,,,,,,,,,,,7_27_2020,,17431,,0.692353705,2,9/5/20 22:31,9/5/20 22:34,1,2,1,Smartphone,1,73,4,6,1,4,1,5,11,NY,1,2,0,1,1,1,3,2,0,0,0,0,2,0,0,0,0,0,0,0,0
Q7U5A6,2020-09-05T20:06:43Z,,2,2,screener,No,No,No,No,No,,,,,,,,,,,,,,,,,,,,0,,,,0,,,,0,,,,0,,,,0,,,,0,,,,,,,,,,,,,,,,,,,,,,,,,,,,,,,,,,,,,,,,,,,,,,,,,7_27_2020,,19325,,0.282537914,2,9/5/20 22:06,9/5/20 22:08,0,2,1,Desktop,2,62,4,5,2,3,1,5,13,OH,2,3,1,0,2,3,4,2,0,0,0,0,2,0,0,0,0,0,0,0,0
O8F4A8,2020-09-05T19:15:03Z,,2,2,screener,No,,No,No,No,,,,,,,,,,,,,,,,,,,,0,,,,0,,,,0,,,,0,,,,0,,,,0,,,,,,,,,,,,,,,,,,,,,,,,,,,,,,,,,,,,,,,,,,,,,,,,,7_27_2020,,30702,,0.608520767,2,9/5/20 18:14,9/5/20 18:15,0,2,1,Desktop,2,57,3,5,6,5,1,5,15,CA,4,9,1,1,1,1,2,6,0,0,0,1,5,0,0,0,0,0,0,0,0
K6F2P7,2020-09-05T18:35:42Z,,2,2,screener,No,No,No,No,No,Yes,,,,,,,,,,,,,,,,,,,0,,,,0,,,,0,,,,0,,,,0,,,,0,,,,,,,,,,,,,,,,,,,,,,,,,,,,,,,,,,,,,,,,,,,,,,,,,7_27_2020,,24277,,0.728662966,2,9/5/20 19:35,9/5/20 19:36,0,2,1,Smartphone,2,59,3,5,1,5,1,1,18,MS,3,6,0,1,1,1,2,6,0,2,1,0,4,0,0,0,0,0,0,0,0
L7Y6W6,2020-09-05T17:30:57Z,,2,2,screener,No,No,No,No,No,Yes,,,,,,,,,,,,,,,,,,,0,,,,0,,,,0,,,,0,,,,0,,,,0,,,,,,,,,,,,,,,,,,,,,,,,,,,,,,,,,,,,,,,,,,,,,,,,,7_27_2020,,27416,,0.822283899,2,9/5/20 16:30,9/5/20 16:31,0,2,1,Desktop,2,44,2,3,4,4,1,1,11,CA,4,9,1,1,2,1,4,4,0,0,2,0,2,0,0,0,0,0,0,0,0
R0F4N7,2020-09-05T15:53:10Z,,2,2,screener,No,No,,No,No,No,,,,,,,,,,,,,,,,,,,0,,,,0,,,,0,,,,0,,,,0,,,,0,,,,,,,,,,,,,,,,,,,,,,,,,,,,,,,,,,,,,,,,,,,,,,,,,7_27_2020,,14098,,0.698654766,2,9/5/20 13:53,9/5/20 13:54,0,2,1,Smartphone,2,40,2,3,1,5,1,1,17,AK,4,9,1,1,1,1,4,4,0,0,0,2,2,0,0,0,0,0,0,0,0
Q7D6C1,2020-09-05T15:23:11Z,,2,2,screener,No,No,No,No,No,No,,,,,,,,,,,,,,,,,,,0,,,,0,,,,0,,,,0,,,,0,,,,0,,,,,,,,,,,,,,,,,,,,,,,,,,,,,,,,,,,,,,,,,,,,,,,,,7_27_2020,,25237,,0.837604825,2,9/5/20 16:23,9/5/20 16:24,0,2,1,Smartphone,2,28,1,2,4,4,1,1,10,TX,3,7,1,1,1,1,4,2,0,0,0,0,2,0,0,0,0,0,0,0,0
Y0W1W0,2020-09-05T15:05:25Z,,2,2,screener,No,No,No,No,No,No,,,,,,,,,,,,,,,,,,,0,,,,0,,,,0,,,,0,,,,0,,,,0,,,,,,,,,,,,,,,,,,,,,,,,,,,,,,,,,,,,,,,,,,,,,,,,,7_27_2020,,20194,,1.062428701,2,9/5/20 17:05,9/5/20 17:06,0,2,1,Smartphone,2,36,2,3,1,4,1,1,7,NY,1,2,0,1,2,1,4,5,0,1,2,0,2,0,0,0,0,0,0,0,0
D1Q1W2,2020-09-05T13:51:38Z,,2,2,screener,No,No,No,No,No,No,,,,,,,,,,,,,,,,,,,0,,,,0,,,,0,,,,0,,,,0,,,,0,,,,,,,,,,,,,,,,,,,,,,,,,,,,,,,,,,,,,,,,,,,,,,,,,7_27_2020,,480,,1.100771064,2,9/5/20 14:51,9/5/20 14:52,0,2,1,Smartphone,2,27,1,2,1,3,1,2,7,WI,2,3,0,1,1,1,4,3,0,0,0,0,2,0,0,0,0,0,0,0,0
K9R6O6,2020-09-05T13:26:02Z,,2,2,screener,No,No,No,No,No,No,,,,,,,,,,,,,,,,,,,0,,,,0,,,,0,,,,0,,,,0,,,,0,,,,,,,,,,,,,,,,,,,,,,,,,,,,,,,,,,,,,,,,,,,,,,,,,7_27_2020,,29680,,0.73407367,2,9/5/20 15:25,9/5/20 15:28,0,2,1,Smartphone,2,68,4,6,1,3,1,1,14,NY,1,2,0,1,1,1,2,2,0,0,0,0,2,0,0,0,0,0,0,0,0
D6S0C8,2020-09-05T13:19:13Z,,2,2,screener,No,No,No,No,No,Yes,,,,,,,,,,,,,,,,,,,0,,,,0,,,,0,,,,0,,,,0,,,,0,,,,,,,,,,,,,,,,,,,,,,,,,,,,,,,,,,,,,,,,,,,,,,,,,7_27_2020,,26195,,0.696808771,2,8/19/20 21:21,9/5/20 15:20,2,2,1,Smartphone,1,65,4,6,1,3,1,5,11,GA,3,5,1,1,1,1,2,5,0,0,0,1,4,0,0,0,0,0,0,0,0
P5S1Q6,2020-09-05T13:15:57Z,,2,2,screener,No,No,No,No,No,Yes,,,,,,,,,,,,,,,,,,,0,,,,0,,,,0,,,,0,,,,0,,,,0,,,,,,,,,,,,,,,,,,,,,,,,,,,,,,,,,,,,,,,,,,,,,,,,,7_27_2020,,26209,,0.427547276,2,9/5/20 14:15,9/5/20 14:17,0,2,1,Desktop,2,33,2,2,1,5,1,1,13,TX,3,7,1,1,2,3,4,2,0,0,0,0,2,0,0,0,0,0,0,0,0
T8Q5B4,2020-09-05T13:01:33Z,,2,2,screener,No,No,No,No,No,No,,,,,,,,,,,,,,,,,,,0,,,,0,,,,0,,,,0,,,,0,,,,0,,,,,,,,,,,,,,,,,,,,,,,,,,,,,,,,,,,,,,,,,,,,,,,,,7_27_2020,,30545,,0.877124021,2,9/5/20 14:01,9/5/20 14:02,0,2,1,Desktop,2,54,3,4,2,3,1,6,3,TN,3,6,1,1,1,1,2,3,0,0,0,0,3,0,0,0,0,0,0,0,0
N3M3F2,2020-09-05T11:46:01Z,,2,2,screener,No,No,No,No,No,No,,,,,,,,,,,,,,,,,,,0,,,,0,,,,0,,,,0,,,,0,,,,0,,,,,,,,,,,,,,,,,,,,,,,,,,,,,,,,,,,,,,,,,,,,,,,,,7_27_2020,,30635,,1.861994742,2,9/5/20 13:45,9/5/20 13:47,0,2,1,Smartphone,2,45,3,4,2,3,5,1,16,SC,3,5,1,0,2,3,4,4,0,0,0,1,3,0,0,0,0,0,0,0,0
P0P6Y6,2020-09-05T11:36:36Z,,2,2,screener,No,No,No,No,No,Yes,,,,,,,,,,,,,,,,,,,0,,,,0,,,,0,,,,0,,,,0,,,,0,,,,,,,,,,,,,,,,,,,,,,,,,,,,,,,,,,,,,,,,,,,,,,,,,7_27_2020,,12625,,0.988979035,2,9/5/20 13:36,9/5/20 13:37,0,2,1,Desktop,1,50,3,4,5,4,1,1,10,NC,3,5,1,1,1,1,3,2,0,0,0,0,2,0,0,0,0,0,0,0,0
H5V0O9,2020-09-05T11:35:52Z,,2,2,screener,No,No,No,No,No,No,,,,,,,,,,,,,,,,,,,0,,,,0,,,,0,,,,0,,,,0,,,,0,,,,,,,,,,,,,,,,,,,,,,,,,,,,,,,,,,,,,,,,,,,,,,,,,7_27_2020,,20094,,1.181903196,2,9/5/20 13:35,9/5/20 13:36,0,2,1,Smartphone,1,41,2,3,1,3,3,1,6,NY,1,2,0,1,2,3,4,2,0,0,0,0,1,0,0,0,0,0,0,0,0
Z6D6O3,2020-09-05T09:52:45Z,,2,2,screener,No,No,No,No,No,No,,,,,,,,,,,,,,,,,,,0,,,,0,,,,0,,,,0,,,,0,,,,0,,,,,,,,,,,,,,,,,,,,,,,,,,,,,,,,,,,,,,,,,,,,,,,,,7_27_2020,,16869,,1.43307145,2,9/5/20 9:52,9/5/20 9:53,0,2,1,Desktop,1,26,1,2,1,4,5,1,18,MT,4,8,0,1,3,1,2,3,0,0,0,0,1,0,0,0,0,0,0,0,0
F3Q9F3,2020-09-05T08:17:17Z,,2,2,screener,No,No,No,No,No,Yes,,,,,,,,,,,,,,,,,,,0,,,,0,,,,0,,,,0,,,,0,,,,0,,,,,,,,,,,,,,,,,,,,,,,,,,,,,,,,,,,,,,,,,,,,,,,,,7_27_2020,,25779,,1.483365305,2,9/5/20 10:17,9/5/20 10:19,0,2,1,Smartphone,2,64,4,5,2,2,5,1,11,CT,1,1,1,1,1,2,4,1,0,0,0,0,1,0,0,0,0,0,0,0,0
Y4E9N1,2020-09-05T06:12:30Z,,2,2,screener,No,No,No,No,No,No,,,,,,,,,,,,,,,,,,,0,,,,0,,,,0,,,,0,,,,0,,,,0,,,,,,,,,,,,,,,,,,,,,,,,,,,,,,,,,,,,,,,,,,,,,,,,,7_27_2020,,12494,,1.892292711,2,9/5/20 8:12,9/5/20 8:14,0,2,1,Smartphone,1,25,1,2,4,3,5,7,12,FL,3,5,1,1,1,1,4,3,0,0,0,0,3,0,0,0,0,0,0,0,0
N4C9E5,2020-09-05T02:03:20Z,,2,2,screener,No,No,No,No,No,No,,,,,,,,,,,,,,,,,,,0,,,,0,,,,0,,,,0,,,,0,,,,0,,,,,,,,,,,,,,,,,,,,,,,,,,,,,,,,,,,,,,,,,,,,,,,,,7_27_2020,,12461,,3.254620143,2,9/5/20 4:03,9/5/20 4:03,0,2,1,Smartphone,2,27,1,2,2,2,6,4,3,NC,3,5,1,1,2,1,4,6,0,2,0,0,6,0,0,0,0,0,0,0,0
K4N3X4,2020-09-04T23:40:03Z,,2,2,screener,No,No,No,No,No,Yes,,,,,,,,,,,,,,,,,,,0,,,,0,,,,0,,,,0,,,,0,,,,0,,,,,,,,,,,,,,,,,,,,,,,,,,,,,,,,,,,,,,,,,,,,,,,,,7_27_2020,,19762,,0.796716993,2,9/5/20 0:39,9/5/20 0:41,0,2,1,Smartphone,1,63,4,5,1,3,1,1,8,TX,3,7,1,1,1,1,4,2,0,0,0,0,2,0,0,0,0,0,0,0,0
L9A0Y2,2020-09-04T21:14:51Z,,2,2,screener,No,No,No,No,No,Yes,,,,,,,,,,,,,,,,,,,0,,,,0,,,,0,,,,0,,,,0,,,,0,,,,,,,,,,,,,,,,,,,,,,,,,,,,,,,,,,,,,,,,,,,,,,,,,7_27_2020,,24691,,0.415267475,2,9/4/20 20:14,9/4/20 20:16,0,2,1,Tablet,2,72,4,6,1,5,1,5,15,OR,4,9,1,1,1,1,3,2,0,0,0,0,2,0,0,0,0,0,0,0,0
E7Q0C4,2020-09-04T20:30:53Z,,2,2,screener,No,No,No,No,No,No,,,,,,,,,,,,,,,,,,,0,,,,0,,,,0,,,,0,,,,0,,,,0,,,,,,,,,,,,,,,,,,,,,,,,,,,,,,,,,,,,,,,,,,,,,,,,,7_27_2020,,10557,,0.202194429,2,9/4/20 22:30,9/4/20 22:32,0,2,1,Smartphone,2,60,4,5,1,3,1,2,11,KY,3,6,1,0,2,1,4,4,0,0,0,0,4,0,0,0,0,0,0,0,0
S2K6D9,2020-09-04T20:29:56Z,,2,2,screener,No,No,No,No,No,No,,,,,,,,,,,,,,,,,,,0,,,,0,,,,0,,,,0,,,,0,,,,0,,,,,,,,,,,,,,,,,,,,,,,,,,,,,,,,,,,,,,,,,,,,,,,,,7_27_2020,,6543,,2.028917011,2,9/4/20 19:29,9/4/20 19:30,0,2,1,Smartphone,1,37,2,3,4,3,5,2,4,CA,4,9,1,1,2,3,4,4,0,0,0,1,2,0,0,0,0,0,0,0,0
W3S9P0,2020-09-04T20:29:33Z,,2,2,screener,No,No,No,No,No,Yes,,,,,,,,,,,,,,,,,,,0,,,,0,,,,0,,,,0,,,,0,,,,0,,,,,,,,,,,,,,,,,,,,,,,,,,,,,,,,,,,,,,,,,,,,,,,,,7_27_2020,,11566,,0.420421552,2,8/5/20 21:59,9/4/20 21:31,0,2,1,Smartphone,2,63,4,5,2,3,3,1,8,LA,3,7,1,1,2,1,4,6,0,0,2,1,3,0,0,0,0,0,0,0,0
Y7C6W9,2020-09-04T19:59:59Z,,2,2,screener,No,No,No,No,No,No,,,,,,,,,,,,,,,,,,,0,,,,0,,,,0,,,,0,,,,0,,,,0,,,,,,,,,,,,,,,,,,,,,,,,,,,,,,,,,,,,,,,,,,,,,,,,,7_27_2020,,16158,,0.472741953,2,9/4/20 21:59,9/4/20 22:01,1,2,1,Desktop,2,60,4,5,1,5,5,1,13,MA,1,1,1,1,1,1,1,3,0,0,0,0,3,0,0,0,0,0,0,0,0
R9P3C3,2020-09-04T18:04:43Z,,2,2,inconsistent,Yes,Yes,Yes,,No,Yes,3,4,1,1,1,1,0,0,0,0,0,0,0,0,0,0,0,0,0,,,,0,,,,0,,,,0,600,"One day I made postcards for a former professor and she never paid me. Also, many times I bought traditional dresses and never got any.",N,0,,,,0,,,,,,,,,,,,,,,,,,,,,,,,,,,,,,,,,,,,,,,,,,,,,,,,,,,21167,,0.608624438,2,8/23/20 22:44,9/4/20 20:10,0,2,1,Desktop,2,39,2,3,1,5,1,1,8,MA,1,1,1,1,2,3,4,4,0,0,2,0,2,0,0,0,0,0,0,0,0
A5L4U5,2020-09-04T17:29:30Z,,2,2,screener,No,No,No,No,No,No,,,,,,,,,,,,,,,,,,,0,,,,0,,,,0,,,,0,,,,0,,,,0,,,,,,,,,,,,,,,,,,,,,,,,,,,,,,,,,,,,,,,,,,,,,,,,,7_27_2020,,13595,,2.221051722,2,9/4/20 19:29,9/4/20 19:31,1,2,1,Desktop,2,64,4,5,2,2,5,1,7,NY,1,2,1,1,1,1,4,2,0,0,0,0,2,0,0,0,0,0,0,0,0
V0U2D1,2020-09-04T17:28:38Z,,2,2,inconsistent,No,Yes,Yes,Yes,No,Yes,5,3,1,4,1,1,1,1,5,1,4,6,3,0,2,1,6,0,0,,,,0,,,,0,,,,0,,,,0,,,,0,,,,,,,,,,,,,,,,,,,,,,,,,,,,,,,,,,,,,,,,,,,,,,,,,7_27_2020,,27819,,0.389491571,2,9/4/20 19:28,9/4/20 19:30,0,2,1,Smartphone,2,25,1,2,3,3,5,1,8,MI,2,3,1,1,2,1,2,2,0,0,0,0,2,0,0,0,0,0,0,0,0
O0Z7U9,2020-09-04T15:52:48Z,,2,2,screener,No,No,No,No,No,No,,,,,,,,,,,,,,,,,,,0,,,,0,,,,0,,,,0,,,,0,,,,0,,,,,,,,,,,,,,,,,,,,,,,,,,,,,,,,,,,,,,,,,,,,,,,,,7_27_2020,,22680,,2.423860358,2,9/4/20 16:52,9/4/20 16:55,0,2,1,Smartphone,2,38,2,3,2,1,5,7,4,KS,2,4,1,1,2,1,4,3,0,0,0,0,1,0,0,0,0,0,0,0,0
F3P4V1,2020-09-04T14:23:04Z,,2,2,screener,No,No,No,No,No,No,,,,,,,,,,,,,,,,,,,0,,,,0,,,,0,,,,0,,,,0,,,,0,,,,,,,,,,,,,,,,,,,,,,,,,,,,,,,,,,,,,,,,,,,,,,,,,7_27_2020,,27905,,0.797918322,2,9/4/20 15:22,9/4/20 15:23,0,2,1,Desktop,1,56,3,5,1,3,4,1,13,WI,2,3,1,1,1,2,2,2,0,0,0,0,2,0,0,0,0,0,0,0,0
G9R7R9,2020-09-04T12:24:58Z,,2,2,screener,No,No,No,No,No,No,,,,,,,,,,,,,,,,,,,0,,,,0,,,,0,,,,0,,,,0,,,,0,,,,,,,,,,,,,,,,,,,,,,,,,,,,,,,,,,,,,,,,,,,,,,,,,7_27_2020,,7767,,1.363134862,2,9/4/20 14:24,9/4/20 14:25,0,2,1,Desktop,1,38,2,3,4,4,1,1,15,NY,1,2,1,1,2,3,4,5,0,0,2,0,3,0,0,0,0,0,0,0,0
L1K0Z9,2020-09-04T11:54:29Z,,2,2,screener,No,No,No,No,No,No,,,,,,,,,,,,,,,,,,,0,,,,0,,,,0,,,,0,,,,0,,,,0,,,,,,,,,,,,,,,,,,,,,,,,,,,,,,,,,,,,,,,,,,,,,,,,,7_27_2020,,29700,,0.480499505,2,9/4/20 13:54,9/4/20 13:55,0,2,1,Desktop,2,69,4,6,1,5,2,5,9,NY,1,2,1,1,1,1,3,1,0,0,0,0,1,0,0,0,0,0,0,0,0
M8E4G5,2020-09-04T11:28:43Z,,2,2,inconsistent,No,Yes,No,No,Yes,Yes,4,4,4,3,3,4,0,2,0,0,0,0,1,0,1,0,1,0,0,,,,0,,,,0,,,,0,,,,0,,,,0,,,,,,,,,,,,,,,,,,,,,,,,,,,,,,,,,,,,,,,,,,,,,,,,,7_27_2020,,7843,,5.528376985,2,8/18/20 1:41,9/4/20 13:30,0,2,1,Smartphone,1,38,2,3,2,2,6,7,2,VA,3,5,0,1,2,4,4,5,2,0,1,0,2,0,0,0,0,0,0,0,0
J2C6G9,2020-09-04T10:14:28Z,,2,2,screener,No,No,No,No,No,,,,,,,,,,,,,,,,,,,,0,,,,0,,,,0,,,,0,,,,0,,,,0,,,,,,,,,,,,,,,,,,,,,,,,,,,,,,,,,,,,,,,,,,,,,,,,,7_27_2020,,11879,,0.585264261,2,9/4/20 9:14,9/4/20 9:15,0,2,1,Desktop,1,34,2,2,1,5,5,1,14,CA,4,9,1,1,2,3,4,1,0,0,0,0,1,0,0,0,0,0,0,0,0
K1Q1M3,2020-09-04T09:02:15Z,,2,1,no,No,Yes,No,No,No,Yes,5,5,3,2,2,2,2,1,1,1,1,2,1,1,1,1,1,0,0,,,,0,,,,0,,,,0,60,I sent money and never received product,N,0,,,,0,,,,,,,,,,,,,,,,,,,,,,,,,,,,,,,,,,,,,,No,,,,,,,,,,,,,10649,,0.675156387,1,9/4/20 10:01,9/4/20 10:05,1,2,1,Smartphone,2,41,2,3,2,3,2,1,5,IL,2,3,1,1,2,3,4,6,0,1,1,2,6,0,0,0,0,0,0,0,0
L6A4P9,2020-09-04T08:48:23Z,,2,2,screener,No,No,No,No,No,No,,,,,,,,,,,,,,,,,,,0,,,,0,,,,0,,,,0,,,,0,,,,0,,,,,,,,,,,,,,,,,,,,,,,,,,,,,,,,,,,,,,,,,,,,,,,,,7_27_2020,,5050,,2.430876205,2,9/4/20 10:48,9/4/20 10:49,0,2,1,Smartphone,1,31,2,2,4,5,1,1,13,NC,3,5,1,1,2,3,4,2,0,0,0,0,2,0,0,0,0,0,0,0,0
K9W5G0,2020-09-04T08:43:57Z,,2,2,screener,No,No,No,No,No,Yes,,,,,,,,,,,,,,,,,,,0,,,,0,,,,0,,,,0,,,,0,,,,0,,,,,,,,,,,,,,,,,,,,,,,,,,,,,,,,,,,,,,,,,,,,,,,,,7_27_2020,,29289,,1.414620689,2,9/4/20 9:43,9/4/20 9:44,0,2,1,Smartphone,2,28,1,2,1,4,5,1,14,VA,3,5,1,1,1,1,4,1,0,0,0,0,1,0,0,0,0,0,0,0,0
R5R1W1,2020-09-04T08:16:41Z,,2,2,inconsistent,No,Yes,Yes,No,No,Yes,4,3,5,5,4,4,0,0,0,2,0,0,0,0,0,1,1,1,0,,,,0,,,,0,,,,0,,,,0,,,,0,,,,,,,,,,,,,,,,,,,,,,,,,,,,,,,,,,,,,,,,,,,,,,,,,7_27_2020,,9413,,1.66163812,2,9/4/20 10:16,9/4/20 10:19,0,2,1,Smartphone,1,38,2,3,2,3,5,1,11,NY,1,2,1,1,2,3,2,3,0,0,0,0,3,0,0,0,0,0,0,0,0
F8E9W1,2020-09-04T07:52:05Z,,2,2,screener,No,No,No,No,No,No,,,,,,,,,,,,,,,,,,,0,,,,0,,,,0,,,,0,,,,0,,,,0,,,,,,,,,,,,,,,,,,,,,,,,,,,,,,,,,,,,,,,,,,,,,,,,,7_27_2020,,25406,,0.75351142,2,9/4/20 9:51,9/4/20 9:54,0,2,1,Desktop,2,57,3,5,1,3,3,1,11,NY,1,2,1,1,2,2,3,2,0,0,0,0,2,0,0,0,0,0,0,0,0
B2M2G4,2020-09-04T06:52:16Z,,2,2,inconsistent,No,No,No,Yes,No,No,3,,1,1,1,1,0,0,0,0,0,0,0,0,1,0,1,0,0,,,,0,,,,0,,,,0,,,,0,,,,0,,,,,,,,,,,,,,,,,,,,,,,,,,,,,,,,,,,,,,,,,,,,,,,,,7_27_2020,,13347,,0.939517005,2,8/28/20 10:18,9/4/20 7:53,8,2,1,Smartphone,1,34,2,2,4,3,1,1,13,MO,2,4,1,1,1,1,4,6,0,0,4,0,3,0,0,0,0,0,0,0,0
G0U6P4,2020-09-04T05:26:05Z,,2,2,screener,No,No,No,No,No,Yes,,,,,,,,,,,,,,,,,,,0,,,,0,,,,0,,,,0,,,,0,,,,0,,,,,,,,,,,,,,,,,,,,,,,,,,,,,,,,,,,,,,,,,,,,,,,,,7_27_2020,,5794,,0.68687172,2,8/31/20 11:50,9/4/20 7:27,0,2,1,Smartphone,1,30,2,2,1,4,1,1,10,OH,2,3,1,1,2,1,4,5,0,1,2,0,2,0,0,0,0,0,0,0,0
N8H0R7,2020-09-04T00:58:28Z,,2,2,screener,No,No,No,No,No,No,,,,,,,,,,,,,,,,,,,0,,,,0,,,,0,,,,0,,,,0,,,,0,,,,,,,,,,,,,,,,,,,,,,,,,,,,,,,,,,,,,,,,,,,,,,,,,7_27_2020,,12020,,9.634360274,2,9/4/20 2:58,9/4/20 2:58,0,2,1,Smartphone,1,23,1,1,1,1,5,4,12,OH,2,3,1,1,1,1,4,6,0,0,1,0,5,0,0,0,0,0,0,0,0
W7Z5F7,2020-09-04T00:32:53Z,,2,2,screener,No,No,No,No,No,No,,,,,,,,,,,,,,,,,,,0,,,,0,,,,0,,,,0,,,,0,,,,0,,,,,,,,,,,,,,,,,,,,,,,,,,,,,,,,,,,,,,,,,,,,,,,,,7_27_2020,,21922,,0.214863916,2,8/19/20 12:51,9/4/20 0:34,1,2,1,Smartphone,1,69,4,6,1,4,1,2,10,ID,4,8,1,1,1,1,2,2,0,0,0,0,2,0,0,0,0,0,0,0,0
N5Y9O1,2020-09-03T23:21:12Z,,1,1,no,No,No,No,No,No,Yes,4,3,1,1,2,1,0,0,0,0,0,1,0,0,1,0,0,0,1,,Unknown charges on my bank statements,Y,0,,,,0,,,,0,,,,0,,,,0,,,,1,Y,Debit card scam gas station,,0,0,,,,0,,,,0,,,,0,,,,0,,,,,,,,,,,,,,,,,,,No,,,,,,0,2939,0.567302313,0.88455614,1,7/27/20 9:48,9/3/20 22:42,0,2,1,Smartphone,2,31,2,2,4,3,1,1,11,CA,4,9,1,1,1,1,4,6,0,1,1,1,4,0,1,0,0,0,0,0,0
E8J9P7,2020-09-03T23:18:32Z,,1,1,no,No,No,No,No,No,No,5,5,3,4,3,4,1,0,1,1,1,3,0,0,1,0,2,1,0,,,,0,,,,0,,,,0,,,,0,,,,0,,,,1,Y,They indicated they had a credit card stolen but were able to stop the charges before they were to much.,,0,0,,,,0,,,,0,,,,0,,,,0,,,,,,,,,,,,,,,,,,,,,,,,,0,1900,2.400265553,1.604514948,1,9/3/20 22:18,9/3/20 22:23,1,2,1,Desktop,2,46,3,4,4,4,1,1,11,AZ,4,8,1,0,1,1,4,4,0,0,0,0,1,0,1,0,0,0,0,0,0
W7B0P6,2020-09-03T22:11:04Z,,2,2,screener,No,No,No,No,No,No,,,,,,,,,,,,,,,,,,,0,,,,0,,,,0,,,,0,,,,0,,,,0,,,,,,,,,,,,,,,,,,,,,,,,,,,,,,,,,,,,,,,,,,,,,,,,,7_27_2020,,14234,,0.753061942,2,9/4/20 0:10,9/4/20 0:12,0,2,1,Desktop,1,63,4,5,1,3,1,5,13,PA,1,2,1,1,1,1,2,2,0,0,0,0,2,0,0,0,0,0,0,0,0
F6F2S1,2020-09-03T22:00:01Z,,2,2,screener,No,No,No,No,No,Yes,,,,,,,,,,,,,,,,,,,0,,,,0,,,,0,,,,0,,,,0,,,,0,,,,,,,,,,,,,,,,,,,,,,,,,,,,,,,,,,,,,,,,,,,,,,,,,7_27_2020,,29323,,0.526640453,2,9/3/20 22:59,9/3/20 23:03,1,2,1,Desktop,1,74,4,6,1,5,5,5,7,TX,3,7,1,1,1,1,4,1,0,0,0,0,1,0,0,0,0,0,0,0,0
W8V3C2,2020-09-03T21:13:42Z,,2,2,screener,No,No,No,No,No,Yes,,,,,,,,,,,,,,,,,,,0,,,,0,,,,0,,,,0,,,,0,,,,0,,,,,,,,,,,,,,,,,,,,,,,,,,,,,,,,,,,,,,,,,,,,,,,,,7_27_2020,,25238,,0.523444523,2,9/3/20 23:13,9/3/20 23:16,0,2,1,Smartphone,2,39,2,3,2,5,5,1,11,OH,2,3,1,1,1,1,2,5,0,0,0,2,1,0,0,0,0,0,0,0,0
K7M8I9,2020-09-03T20:02:51Z,,2,2,screener,No,No,No,No,No,Yes,,,,,,,,,,,,,,,,,,,0,,,,0,,,,0,,,,0,,,,0,,,,0,,,,,,,,,,,,,,,,,,,,,,,,,,,,,,,,,,,,,,,,,,,,,,,,,7_27_2020,,22012,,1.157638913,2,9/3/20 19:02,9/3/20 19:03,0,2,1,Desktop,2,28,1,2,1,4,5,4,6,CA,4,9,1,1,1,1,4,3,0,0,0,0,2,0,0,0,0,0,0,0,0
A4C1R7,2020-09-03T19:24:45Z,,2,2,screener,No,No,Yes,No,No,Yes,,,,,,,,,,,,,,,,,,,0,,,,0,,,,0,,,,0,,,,0,,,,0,,,,,,,,,,,,,,,,,,,,,,,,,,,,,,,,,,,,,,,,,,,,,,,,,7_27_2020,,15433,,1.500950227,2,8/27/20 18:34,9/3/20 21:26,0,2,1,Smartphone,2,55,3,5,2,2,3,1,9,VA,3,5,1,1,1,2,4,3,0,0,0,0,3,0,0,0,0,0,0,0,0
V2B7W5,2020-09-03T18:44:14Z,,2,2,screener,No,No,No,No,No,No,,,,,,,,,,,,,,,,,,,0,,,,0,,,,0,,,,0,,,,0,,,,0,,,,,,,,,,,,,,,,,,,,,,,,,,,,,,,,,,,,,,,,,,,,,,,,,7_27_2020,,14393,,0.903734531,2,9/3/20 17:43,9/3/20 17:46,1,2,1,Smartphone,2,67,4,6,2,4,6,1,7,CA,4,9,1,1,2,1,2,1,0,0,0,0,1,0,0,0,0,0,0,0,0
J1M6Z9,2020-09-03T16:36:27Z,,2,2,screener,No,No,No,No,No,No,,,,,,,,,,,,,,,,,,,0,,,,0,,,,0,,,,0,,,,0,,,,0,,,,,,,,,,,,,,,,,,,,,,,,,,,,,,,,,,,,,,,,,,,,,,,,,7_27_2020,,9502,,0.903708078,2,9/3/20 18:36,9/3/20 18:37,0,2,1,Smartphone,2,31,2,2,4,3,5,4,6,OH,2,3,1,1,2,1,5,5,0,0,0,0,5,0,0,0,0,0,0,0,0
J8C8E7,2020-09-03T16:33:14Z,,2,2,screener,No,No,No,No,No,No,,,,,,,,,,,,,,,,,,,0,,,,0,,,,0,,,,0,,,,0,,,,0,,,,,,,,,,,,,,,,,,,,,,,,,,,,,,,,,,,,,,,,,,,,,,,,,7_27_2020,,4377,,0.89003086,2,9/3/20 15:33,9/3/20 15:34,0,2,1,Smartphone,2,36,2,3,4,3,5,1,9,CA,4,9,1,1,2,1,4,4,0,0,0,0,4,0,0,0,0,0,0,0,0
Y6X2T2,2020-09-03T16:03:44Z,,2,2,screener,No,No,No,No,No,No,,,,,,,,,,,,,,,,,,,0,,,,0,,,,0,,,,0,,,,0,,,,0,,,,,,,,,,,,,,,,,,,,,,,,,,,,,,,,,,,,,,,,,,,,,,,,,7_27_2020,,5074,,0.560352076,2,9/3/20 16:03,9/3/20 16:04,0,2,1,Smartphone,2,31,2,2,1,5,1,1,14,CO,4,8,1,1,1,1,4,3,0,1,0,0,2,0,0,0,0,0,0,0,0
L1Z9Q1,2020-09-03T15:41:41Z,,2,2,screener,No,No,No,No,No,No,,,,,,,,,,,,,,,,,,,0,,,,0,,,,0,,,,0,,,,0,,,,0,,,,,,,,,,,,,,,,,,,,,,,,,,,,,,,,,,,,,,,,,,,,,,,,,7_27_2020,,22412,,0.921844031,2,9/3/20 7:32,9/3/20 17:44,0,2,1,Desktop,2,45,3,4,1,4,1,1,9,OH,2,3,1,1,1,1,4,6,0,0,0,2,3,0,0,0,0,0,0,0,0
P2W8N9,2020-09-03T14:37:08Z,,2,1,no,No,Yes,No,No,No,Yes,4,4,4,4,1,1,0,1,2,0,1,1,2,1,3,0,1,0,0,,,,0,,,,0,,,,0,,,,0,,,,0,,,,,,,,,,,,,,,,,,,,,,,,,,,,,,,,,,,,,,,,,,,,,,,,,,,23038,,0.722461195,1,9/3/20 15:37,9/3/20 15:39,1,2,1,Desktop,2,47,3,4,1,3,1,1,14,TX,3,7,0,1,1,1,4,6,0,0,0,3,3,0,0,0,0,0,0,0,0
N8G6F5,2020-09-03T13:56:23Z,,2,2,screener,No,No,Yes,No,No,Yes,,,,,,,,,,,,,,,,,,,0,,,,0,,,,0,,,,0,,,,0,,,,0,,,,,,,,,,,,,,,,,,,,,,,,,,,,,,,,,,,,,,,,,,,,,,,,,7_27_2020,,13470,,0.274531214,2,9/3/20 12:56,9/3/20 12:57,0,2,1,Desktop,2,69,4,6,1,5,3,1,13,NV,4,8,1,1,1,1,4,2,0,0,0,0,2,0,0,0,0,0,0,0,0
L6D1B7,2020-09-03T13:36:47Z,,2,2,screener,No,No,No,No,No,No,,,,,,,,,,,,,,,,,,,0,,,,0,,,,0,,,,0,,,,0,,,,0,,,,,,,,,,,,,,,,,,,,,,,,,,,,,,,,,,,,,,,,,,,,,,,,,7_27_2020,,22704,,3.377934459,2,9/3/20 15:36,9/3/20 15:37,0,2,1,Smartphone,2,41,2,3,3,2,3,1,7,NY,1,2,1,1,1,3,2,3,0,0,0,0,1,0,0,0,0,0,0,0,0
E6N2Q3,2020-09-03T13:29:27Z,,2,2,screener,No,No,No,No,No,No,,,,,,,,,,,,,,,,,,,0,,,,0,,,,0,,,,0,,,,0,,,,0,,,,,,,,,,,,,,,,,,,,,,,,,,,,,,,,,,,,,,,,,,,,,,,,,7_27_2020,,23390,,0.898282233,2,9/3/20 14:29,9/3/20 14:30,0,2,1,Smartphone,2,22,1,1,5,3,1,7,3,OK,3,7,1,0,1,3,4,4,0,0,0,0,4,0,0,0,0,0,0,0,0
F8O0Y3,2020-09-03T12:57:34Z,,2,2,screener,No,No,Yes,No,No,No,,,,,,,,,,,,,,,,,,,0,,,,0,,,,0,,,,0,,,,0,,,,0,,,,,,,,,,,,,,,,,,,,,,,,,,,,,,,,,,,,,,,,,,,,,,,,,7_27_2020,,25668,,0.463004777,2,8/26/20 19:42,9/3/20 14:59,1,2,1,Smartphone,2,61,4,5,1,2,3,7,5,OH,2,3,1,0,2,3,4,3,0,0,0,0,1,0,0,0,0,0,0,0,0
Y3T8S1,2020-09-03T11:53:05Z,,2,2,screener,No,No,No,No,No,No,,,,,,,,,,,,,,,,,,,0,,,,0,,,,0,,,,0,,,,0,,,,0,,,,,,,,,,,,,,,,,,,,,,,,,,,,,,,,,,,,,,,,,,,,,,,,,7_27_2020,,14986,,0.611013168,2,9/3/20 11:52,9/3/20 11:54,0,2,1,Desktop,1,64,4,5,1,5,1,2,18,CO,4,8,0,1,1,1,1,2,0,0,0,0,2,0,0,0,0,0,0,0,0
Q2V0G2,2020-09-03T11:43:07Z,,1,1,no,No,No,Yes,No,No,No,4,4,1,1,3,1,0,0,0,0,0,1,0,0,0,1,0,0,1,,My card was changed twice but I got it back,Y,1,400,I ordered something online that said it was delivered but I never received it,Y,0,,,,0,400,,N,0,,,,0,,,,1,Y,Using their name to open an account,,,0,,,,0,,,,0,,,,0,,,,0,,,,,,,,,,,,,No,,,No,,,No,,,,,,0,3674,0.956879405,1.702520319,1,9/3/20 13:42,9/3/20 13:51,0,2,1,Smartphone,2,24,1,1,2,3,5,1,10,DC,3,5,1,1,2,3,4,1,0,0,0,0,1,0,1,0,0,0,0,0,0
T8D3E3,2020-09-03T11:32:38Z,,2,2,screener,No,No,No,No,No,No,,,,,,,,,,,,,,,,,,,0,,,,0,,,,0,,,,0,,,,0,,,,0,,,,,,,,,,,,,,,,,,,,,,,,,,,,,,,,,,,,,,,,,,,,,,,,,7_27_2020,,5204,,1.688293713,2,9/3/20 13:32,9/3/20 13:33,0,2,1,Desktop,1,47,3,4,1,3,1,1,17,MD,3,5,1,1,1,1,2,4,0,0,0,0,4,0,0,0,0,0,0,0,0
E5H1V8,2020-09-03T11:23:35Z,,2,2,screener,No,No,No,No,No,No,,,,,,,,,,,,,,,,,,,0,,,,0,,,,0,,,,0,,,,0,,,,0,,,,,,,,,,,,,,,,,,,,,,,,,,,,,,,,,,,,,,,,,,,,,,,,,7_27_2020,,29115,,0.286571352,2,9/3/20 10:23,9/3/20 10:26,1,2,1,Smartphone,2,60,4,5,1,3,5,7,7,WA,4,9,1,1,2,1,3,5,0,0,0,2,3,0,0,0,0,0,0,0,0
S8K6C7,2020-09-03T10:17:18Z,,2,2,screener,No,No,Yes,No,No,No,,,,,,,,,,,,,,,,,,,0,,,,0,,,,0,,,,0,,,,0,,,,0,,,,,,,,,,,,,,,,,,,,,,,,,,,,,,,,,,,,,,,,,,,,,,,,,7_27_2020,,27934,,1.706422281,2,9/3/20 11:16,9/3/20 11:18,1,2,1,Smartphone,2,45,3,4,1,2,1,1,16,MO,2,4,0,1,1,1,4,3,0,0,0,0,1,0,0,0,0,0,0,0,0
C7M1B7,2020-09-03T10:05:36Z,,2,2,screener,No,No,No,No,No,Yes,,,,,,,,,,,,,,,,,,,0,,,,0,,,,0,,,,0,,,,0,,,,0,,,,,,,,,,,,,,,,,,,,,,,,,,,,,,,,,,,,,,,,,,,,,,,,,7_27_2020,,28290,,0.491574055,2,9/3/20 12:05,9/3/20 12:15,0,2,1,Desktop,2,56,3,5,1,3,1,1,14,MI,2,3,1,1,1,1,3,6,0,0,0,0,6,0,0,0,0,0,0,0,0
A5D6R3,2020-09-03T09:56:20Z,,2,2,screener,No,No,No,No,No,No,,,,,,,,,,,,,,,,,,,0,,,,0,,,,0,,,,0,,,,0,,,,0,,,,,,,,,,,,,,,,,,,,,,,,,,,,,,,,,,,,,,,,,,,,,,,,,7_27_2020,,21291,,0.337538533,2,9/3/20 9:56,9/3/20 9:57,0,2,1,Desktop,1,67,4,6,1,4,1,1,11,AZ,4,8,1,0,2,2,4,2,0,0,0,0,2,0,0,0,0,0,0,0,0
A0H0D2,2020-09-03T09:22:58Z,,2,2,screener,No,No,No,No,No,Yes,,,,,,,,,,,,,,,,,,,0,,,,0,,,,0,,,,0,,,,0,,,,0,,,,,,,,,,,,,,,,,,,,,,,,,,,,,,,,,,,,,,,,,,,,,,,,,7_27_2020,,28869,,1.393180491,2,9/3/20 11:22,9/3/20 11:24,0,2,1,Desktop,2,40,2,3,2,5,5,1,4,NY,1,2,1,1,2,3,2,5,0,0,1,0,3,0,0,0,0,0,0,0,0
U5A1J7,2020-09-03T09:07:07Z,,1,1,no,No,No,No,No,No,No,4,4,4,4,3,4,0,0,1,0,1,3,0,0,1,0,1,0,1,,Was sent a fraudulent check,Y,0,,,,0,,,,0,,,,0,,,,0,,,,1,Y,Credit card fraud,,0,0,,,,0,,,,0,,,,0,,,,0,,,,,,,,,,,,,,,,,,,No,,,,,,0,1102,0.18250209,0.311975785,1,9/3/20 11:06,9/3/20 11:18,1,2,1,Smartphone,2,33,2,2,5,4,3,1,6,NY,1,2,1,1,2,3,4,3,0,0,0,0,3,0,1,0,0,0,0,0,0
N3E8X8,2020-09-03T08:10:55Z,,2,2,screener,No,No,No,No,No,Yes,,,,,,,,,,,,,,,,,,,0,,,,0,,,,0,,,,0,,,,0,,,,0,,,,,,,,,,,,,,,,,,,,,,,,,,,,,,,,,,,,,,,,,,,,,,,,,7_27_2020,,29196,,0.676530124,2,9/3/20 10:10,9/3/20 10:11,0,2,1,Desktop,2,36,2,3,1,5,3,1,16,GA,3,5,1,1,1,1,4,6,0,0,4,1,1,0,0,0,0,0,0,0,0
A1O1P2,2020-09-03T07:44:06Z,,2,2,screener,No,No,No,No,No,No,,,,,,,,,,,,,,,,,,,0,,,,0,,,,0,,,,0,,,,0,,,,0,,,,,,,,,,,,,,,,,,,,,,,,,,,,,,,,,,,,,,,,,,,,,,,,,7_27_2020,,23823,,1.432667495,2,9/3/20 8:44,9/3/20 8:44,0,2,1,Desktop,2,21,1,1,1,3,5,1,11,IL,2,3,1,1,1,1,2,5,0,0,0,2,3,0,0,0,0,0,0,0,0
V6E2E0,2020-09-03T07:42:04Z,,2,2,screener,No,No,No,No,No,No,,,,,,,,,,,,,,,,,,,0,,,,0,,,,0,,,,0,,,,0,,,,0,,,,,,,,,,,,,,,,,,,,,,,,,,,,,,,,,,,,,,,,,,,,,,,,,7_27_2020,,10924,,1.238093784,2,9/3/20 3:41,9/3/20 3:42,0,2,1,Desktop,2,29,1,2,5,2,5,1,5,HI,4,9,1,0,2,3,4,5,0,1,0,0,3,0,0,0,0,0,0,0,0
C7K7L1,2020-09-03T05:57:05Z,,2,2,inconsistent,Yes,No,No,No,No,No,4,3,3,3,4,4,1,2,1,0,2,4,3,0,5,2,2,1,0,,,,0,,,,0,,,,0,,,,0,,,,0,,,,,,,,,,,,,,,,,,,,,,,,,,,,,,,,,,,,,,,,,,,,,,,,,7_27_2020,,13933,,0.982773301,2,9/3/20 6:57,9/3/20 6:59,0,2,1,Smartphone,2,45,3,4,1,3,3,7,9,AR,3,7,0,0,2,2,4,2,0,0,0,0,1,0,0,0,0,0,0,0,0
N6V3S4,2020-09-03T02:47:49Z,,2,2,inconsistent,Yes,No,Yes,No,Yes,No,5,5,1,1,1,1,3,0,1,2,4,1,4,5,1,5,3,2,0,,,,0,,,,0,,,,0,,,,0,,,,0,,,,,,,,,,,,,,,,,,,,,,,,,,,,,,,,,,,,,,,,,,,,,,,,,7_27_2020,,16186,,1.577206927,2,9/3/20 1:47,9/3/20 1:50,0,2,1,Smartphone,2,35,2,3,4,1,1,4,9,CA,4,9,1,1,2,3,4,6,0,0,5,3,3,0,0,0,0,0,0,0,0
I7Z7O9,2020-09-03T01:19:48Z,,2,2,screener,No,No,Yes,No,No,,,,,,,,,,,,,,,,,,,,0,,,,0,,,,0,,,,0,,,,0,,,,0,,,,,,,,,,,,,,,,,,,,,,,,,,,,,,,,,,,,,,,,,,,,,,,,,7_27_2020,,5407,,5.270688715,2,9/3/20 0:19,9/3/20 0:20,0,2,1,Smartphone,2,22,1,1,2,1,5,4,2,CA,4,9,1,1,1,3,4,1,0,0,0,0,1,0,0,0,0,0,0,0,0
N7U6B2,2020-09-02T23:58:52Z,,2,2,screener,No,No,No,No,No,Yes,,,,,,,,,,,,,,,,,,,0,,,,0,,,,0,,,,0,,,,0,,,,0,,,,,,,,,,,,,,,,,,,,,,,,,,,,,,,,,,,,,,,,,,,,,,,,,7_27_2020,,18875,,0.395991198,2,9/2/20 22:58,9/2/20 23:01,0,2,1,Desktop,1,64,4,5,1,4,5,2,17,AZ,4,8,1,1,1,1,3,2,0,0,0,0,2,0,0,0,0,0,0,0,0
K3E4Y1,2020-09-02T22:11:20Z,,2,2,screener,No,No,No,No,No,No,,,,,,,,,,,,,,,,,,,0,,,,0,,,,0,,,,0,,,,0,,,,0,,,,,,,,,,,,,,,,,,,,,,,,,,,,,,,,,,,,,,,,,,,,,,,,,7_27_2020,,21892,,1.030959872,2,9/3/20 0:10,9/3/20 0:12,0,2,1,Desktop,1,31,2,2,6,5,5,1,6,NY,1,2,1,1,2,3,4,2,0,0,0,0,2,0,0,0,0,0,0,0,0
C9B2H9,2020-09-02T21:39:13Z,,2,2,screener,No,No,No,No,No,No,,,,,,,,,,,,,,,,,,,0,,,,0,,,,0,,,,0,,,,0,,,,0,,,,,,,,,,,,,,,,,,,,,,,,,,,,,,,,,,,,,,,,,,,,,,,,,7_27_2020,,22196,,0.538594213,2,8/31/20 16:39,9/2/20 22:40,0,2,1,Smartphone,2,32,2,2,1,3,1,2,8,TX,3,7,1,1,3,2,4,6,0,0,4,0,2,0,0,0,0,0,0,0,0
K6L3W4,2020-09-02T20:51:32Z,,2,2,screener,No,No,No,No,No,No,,,,,,,,,,,,,,,,,,,0,,,,0,,,,0,,,,0,,,,0,,,,0,,,,,,,,,,,,,,,,,,,,,,,,,,,,,,,,,,,,,,,,,,,,,,,,,7_27_2020,,9577,,1.010711026,2,9/2/20 20:51,9/2/20 20:52,0,2,1,Smartphone,2,23,1,1,1,4,5,3,9,WY,4,8,0,1,2,3,4,2,0,0,0,0,2,0,0,0,0,0,0,0,0
K3M2F6,2020-09-02T20:09:30Z,,2,2,screener,No,No,No,No,No,No,,,,,,,,,,,,,,,,,,,0,,,,0,,,,0,,,,0,,,,0,,,,0,,,,,,,,,,,,,,,,,,,,,,,,,,,,,,,,,,,,,,,,,,,,,,,,,7_27_2020,,26846,,1.236708902,2,9/2/20 22:09,9/2/20 22:10,0,2,1,Desktop,2,45,3,4,1,4,1,2,11,MA,1,1,1,1,1,1,4,2,0,0,0,0,1,0,0,0,0,0,0,0,0
Q1W1K0,2020-09-02T19:59:54Z,,2,1,no,No,Yes,Yes,No,No,Yes,5,5,3,5,5,2,5,0,1,0,5,3,1,2,1,2,0,1,0,,,,0,,,,0,,,,0,20,"We met up in a location, i gave them the item and they took off running",N,0,,,,0,,,,,,,,,,,,,,,,,,,,,,,,,,,,,,,,,,,,,,No,,,,,,,,,,,,,6204,,2.302504336,1,9/2/20 18:59,9/4/20 10:37,0,2,1,Smartphone,1,23,1,1,4,3,6,7,2,CA,4,9,1,1,2,3,4,2,0,0,0,0,2,0,0,0,0,0,0,0,0
Y4D0G4,2020-09-02T19:41:47Z,,2,2,screener,,,,,,,,,,,,,,,,,,,,,,,,,0,,,,0,,,,0,,,,0,,,,0,,,,0,,,,,,,,,,,,,,,,,,,,,,,,,,,,,,,,,,,,,,,,,,,,,,,,,7_27_2020,,5145,,1.683643983,2,9/2/20 21:41,9/2/20 21:42,1,2,1,Desktop,1,27,1,2,2,3,5,1,4,MI,2,3,1,0,2,3,4,4,0,0,0,0,4,0,0,0,0,0,0,0,0
H3X9T5,2020-09-02T17:27:41Z,,2,2,screener,No,No,No,No,No,No,,,,,,,,,,,,,,,,,,,0,,,,0,,,,0,,,,0,,,,0,,,,0,,,,,,,,,,,,,,,,,,,,,,,,,,,,,,,,,,,,,,,,,,,,,,,,,7_27_2020,,24547,,0.322638299,2,9/2/20 16:27,9/2/20 16:30,0,2,1,Desktop,2,58,3,5,1,4,1,1,18,CA,4,9,1,1,1,1,2,5,0,0,0,1,4,0,0,0,0,0,0,0,0
F3M6G2,2020-09-02T16:16:40Z,,1,1,no,No,No,No,No,No,Yes,3,5,3,5,5,3,2,1,0,1,0,0,0,0,0,1,0,0,1,,Called bank and disputed transaction and funds was refunded,Y,0,,,,0,,,,0,,,,0,,,,0,,,,3,N,Ordered items off line and never received them,,500,0,,,,0,,,,0,,,,0,,,,0,,,,,,,,,,,,,,,,,,,No,,,,,,2,2950,0.200552767,0.525516665,1,9/2/20 17:16,9/2/20 17:22,0,2,1,Smartphone,2,35,2,3,2,3,5,4,6,AL,3,6,1,1,2,3,5,5,0,1,0,2,2,0,0,0,0,0,0,0,0
N6X0N0,2020-09-02T15:45:05Z,,2,1,no,No,No,No,Yes,No,Yes,4,5,4,3,3,5,0,1,0,0,0,3,1,0,2,1,0,0,0,,,,0,,,,0,,,,0,,,,1,400,I was denied access to my computer and sensitive information on it until a ransom was paid.,Y,0,,,,,,,,,,,,,,,,,,,,,,,,,,,,,,,,,,,,,,,,,,,,,,,,,,,25996,,0.91900744,1,9/2/20 15:44,9/2/20 15:52,1,2,1,Smartphone,1,42,2,3,1,3,1,7,4,ID,4,8,0,0,2,2,4,3,0,0,0,0,2,0,0,0,0,0,0,0,0
F8N6A7,2020-09-02T15:01:46Z,,2,2,screener,,,,,,,,,,,,,,,,,,,,,,,,,0,,,,0,,,,0,,,,0,,,,0,,,,0,,,,,,,,,,,,,,,,,,,,,,,,,,,,,,,,,,,,,,,,,,,,,,,,,7_27_2020,,13192,,3.278946543,2,9/2/20 17:01,9/2/20 17:02,0,2,1,Smartphone,2,37,2,3,2,2,5,1,5,GA,3,5,1,0,2,4,4,3,0,0,0,0,1,0,0,0,0,0,0,0,0
F9Z1R9,2020-09-02T14:46:39Z,,2,2,screener,No,No,No,No,No,No,,,,,,,,,,,,,,,,,,,0,,,,0,,,,0,,,,0,,,,0,,,,0,,,,,,,,,,,,,,,,,,,,,,,,,,,,,,,,,,,,,,,,,,,,,,,,,7_27_2020,,26660,,0.563365489,2,9/2/20 16:46,9/2/20 16:47,0,2,1,Smartphone,2,43,2,3,1,4,1,7,12,MI,2,3,0,1,1,1,3,6,0,0,2,2,2,0,0,0,0,0,0,0,0
M8Z5Q6,2020-09-02T14:43:38Z,,2,2,screener,No,No,No,No,No,Yes,,,,,,,,,,,,,,,,,,,0,,,,0,,,,0,,,,0,,,,0,,,,0,,,,,,,,,,,,,,,,,,,,,,,,,,,,,,,,,,,,,,,,,,,,,,,,,7_27_2020,,13853,,0.261955071,2,9/2/20 15:43,9/2/20 15:44,0,2,1,Desktop,2,32,2,2,2,4,1,1,15,MO,2,4,1,1,2,3,4,2,0,0,0,0,2,0,0,0,0,0,0,0,0
Y6M4B2,2020-09-02T14:40:33Z,,2,1,no,No,Yes,Yes,No,No,Yes,4,4,2,1,1,3,0,0,2,0,1,1,1,0,1,0,1,0,0,,,,0,,,,0,,,,1,100,I was selling something on Ebay and the buyer never sent money,Y,0,,,,0,,,,,,,,,,,,,,,,,,,,,,,,,,,,,,,,,,,,,,No,,,,,,,,,,,,,12458,,1.409568405,1,9/2/20 15:40,9/2/20 16:43,0,2,1,Smartphone,2,33,2,2,4,3,5,1,6,NJ,1,2,1,1,2,3,4,1,0,0,0,0,1,0,0,0,0,0,0,0,0
C2Q2J9,2020-09-02T14:25:07Z,,2,2,screener,No,No,No,No,No,No,,,,,,,,,,,,,,,,,,,0,,,,0,,,,0,,,,0,,,,0,,,,0,,,,,,,,,,,,,,,,,,,,,,,,,,,,,,,,,,,,,,,,,,,,,,,,,7_27_2020,,5529,,0.629612411,2,9/2/20 15:25,9/2/20 15:25,0,2,1,Smartphone,2,48,3,4,2,5,1,1,18,IL,2,3,1,1,1,1,3,4,0,0,1,1,2,0,0,0,0,0,0,0,0
X9K7Y7,2020-09-02T13:09:16Z,,2,2,screener,No,No,,No,No,Yes,,,,,,,,,,,,,,,,,,,0,,,,0,,,,0,,,,0,,,,0,,,,0,,,,,,,,,,,,,,,,,,,,,,,,,,,,,,,,,,,,,,,,,,,,,,,,,7_27_2020,,15207,,2.312172797,2,9/2/20 14:09,9/2/20 14:10,0,2,1,Smartphone,2,32,2,2,1,1,3,2,4,AL,3,6,1,0,2,1,4,6,0,4,4,2,2,0,0,0,0,0,0,0,0
O3Y3P2,2020-09-02T12:57:14Z,,2,2,screener,No,No,No,No,No,No,,,,,,,,,,,,,,,,,,,0,,,,0,,,,0,,,,0,,,,0,,,,0,,,,,,,,,,,,,,,,,,,,,,,,,,,,,,,,,,,,,,,,,,,,,,,,,7_27_2020,,31405,,1.096756184,2,9/2/20 13:56,9/2/20 13:58,0,2,1,Smartphone,2,38,2,3,2,3,1,1,6,AL,3,6,1,0,2,1,4,6,0,0,1,2,2,0,0,0,0,0,0,0,0
U2J4J3,2020-09-02T12:21:09Z,,2,2,screener,No,No,No,No,No,Yes,,,,,,,,,,,,,,,,,,,0,,,,0,,,,0,,,,0,,,,0,,,,0,,,,,,,,,,,,,,,,,,,,,,,,,,,,,,,,,,,,,,,,,,,,,,,,,7_27_2020,,21702,,0.442314052,2,9/2/20 13:21,9/2/20 13:22,0,2,1,Smartphone,2,53,3,4,1,3,4,1,9,IA,2,4,0,1,2,1,4,1,0,0,0,0,1,0,0,0,0,0,0,0,0
A4C0C4,2020-09-02T11:15:41Z,,2,2,screener,No,No,No,No,No,No,,,,,,,,,,,,,,,,,,,0,,,,0,,,,0,,,,0,,,,0,,,,0,,,,,,,,,,,,,,,,,,,,,,,,,,,,,,,,,,,,,,,,,,,,,,,,,7_27_2020,,18477,,0.627546126,2,9/2/20 13:15,9/2/20 13:16,0,2,1,Smartphone,2,35,2,3,1,3,4,1,10,NH,1,1,1,1,2,3,2,4,0,0,0,0,1,0,0,0,0,0,0,0,0
L1F1S3,2020-09-02T10:22:38Z,,2,2,screener,No,No,No,No,No,No,,,,,,,,,,,,,,,,,,,0,,,,0,,,,0,,,,0,,,,0,,,,0,,,,,,,,,,,,,,,,,,,,,,,,,,,,,,,,,,,,,,,,,,,,,,,,,7_27_2020,,23735,,0.780851669,2,9/2/20 9:22,9/2/20 9:23,0,2,1,Desktop,2,40,2,3,1,3,1,1,14,CA,4,9,1,1,2,3,2,3,0,1,0,0,2,0,0,0,0,0,0,0,0
O9U1F6,2020-09-02T10:11:23Z,,2,2,screener,No,No,No,No,No,No,,,,,,,,,,,,,,,,,,,0,,,,0,,,,0,,,,0,,,,0,,,,0,,,,,,,,,,,,,,,,,,,,,,,,,,,,,,,,,,,,,,,,,,,,,,,,,7_27_2020,,31109,,1.031658769,2,9/2/20 9:11,9/2/20 9:12,0,2,1,Desktop,2,41,2,3,6,5,1,1,18,CA,4,9,1,1,1,2,2,3,0,0,1,0,2,0,0,0,0,0,0,0,0
Q0E9K2,2020-09-02T08:21:01Z,,2,2,inconsistent,Yes,No,No,No,No,No,3,3,3,3,3,3,0,2,4,10,3,2,1,0,0,1,0,3,0,,,,0,,,,0,,,,0,,,,0,,,,0,,,,,,,,,,,,,,,,,,,,,,,,,,,,,,,,,,,,,,,,,,,,,,,,,7_27_2020,,7987,,2.539557895,2,9/2/20 10:20,9/2/20 10:23,1,2,1,Smartphone,2,41,2,3,2,1,6,1,4,MI,2,3,1,0,1,1,4,5,0,0,0,2,3,0,0,0,0,0,0,0,0
Q9U2D7,2020-09-02T07:52:17Z,,2,2,screener,No,No,No,No,No,No,,,,,,,,,,,,,,,,,,,0,,,,0,,,,0,,,,0,,,,0,,,,0,,,,,,,,,,,,,,,,,,,,,,,,,,,,,,,,,,,,,,,,,,,,,,,,,7_27_2020,,25645,,0.578769092,2,9/2/20 8:52,9/2/20 8:52,0,2,1,Desktop,2,39,2,3,1,4,1,7,14,MN,2,4,1,1,1,2,4,5,0,1,2,0,2,0,0,0,0,0,0,0,0
W1J5L7,2020-09-02T07:28:56Z,,2,2,inconsistent,Yes,No,No,No,No,Yes,5,5,5,5,5,5,1,1,1,1,1,1,1,1,1,1,1,1,0,,,,0,,,,0,,,,0,,,,0,,,,0,,,,,,,,,,,,,,,,,,,,,,,,,,,,,,,,,,,,,,,,,,,,,,,,,7_27_2020,,16155,,0.443968568,2,9/2/20 9:28,9/2/20 9:32,0,2,1,Desktop,1,65,4,6,1,5,1,1,17,NJ,1,2,1,1,1,1,2,3,0,0,0,0,3,0,0,0,0,0,0,0,0
T8Y2H6,2020-09-02T07:22:10Z,,2,2,screener,No,No,,No,No,No,,,,,,,,,,,,,,,,,,,0,,,,0,,,,0,,,,0,,,,0,,,,0,,,,,,,,,,,,,,,,,,,,,,,,,,,,,,,,,,,,,,,,,,,,,,,,,7_27_2020,,28321,,1.280824987,2,9/2/20 9:22,9/2/20 9:23,0,2,1,Desktop,2,22,1,1,1,3,6,1,6,VT,1,1,0,0,2,3,4,2,0,0,0,0,2,0,0,0,0,0,0,0,0
J6D4X6,2020-09-02T07:16:36Z,,2,2,screener,No,No,No,No,No,Yes,,,,,,,,,,,,,,,,,,,0,,,,0,,,,0,,,,0,,,,0,,,,0,,,,,,,,,,,,,,,,,,,,,,,,,,,,,,,,,,,,,,,,,,,,,,,,,7_27_2020,,5059,,2.347379692,2,8/4/20 22:45,9/2/20 9:17,0,2,1,Smartphone,1,58,3,5,6,3,5,2,14,NY,1,2,1,1,1,3,4,1,0,0,0,0,1,0,0,0,0,0,0,0,0
O9I0A1,2020-09-02T06:56:59Z,,2,2,screener,No,No,No,No,No,No,,,,,,,,,,,,,,,,,,,0,,,,0,,,,0,,,,0,,,,0,,,,0,,,,,,,,,,,,,,,,,,,,,,,,,,,,,,,,,,,,,,,,,,,,,,,,,7_27_2020,,20716,,1.857802352,2,9/2/20 8:56,9/2/20 8:59,1,2,1,Desktop,2,73,4,6,1,2,3,5,5,DE,3,5,1,1,2,3,2,1,0,0,0,0,1,0,0,0,0,0,0,0,0
M2J7H6,2020-09-02T06:55:50Z,,2,2,screener,No,No,No,No,No,Yes,,,,,,,,,,,,,,,,,,,0,,,,0,,,,0,,,,0,,,,0,,,,0,,,,,,,,,,,,,,,,,,,,,,,,,,,,,,,,,,,,,,,,,,,,,,,,,7_27_2020,,8244,,4.833938013,2,8/29/20 0:02,9/2/20 5:56,0,2,1,Smartphone,2,24,1,1,4,2,4,1,5,CA,4,9,1,0,2,3,4,4,0,0,0,0,4,0,0,0,0,0,0,0,0
J1N0I3,2020-09-02T06:22:32Z,,2,2,screener,No,No,No,No,No,Yes,,,,,,,,,,,,,,,,,,,0,,,,0,,,,0,,,,0,,,,0,,,,0,,,,,,,,,,,,,,,,,,,,,,,,,,,,,,,,,,,,,,,,,,,,,,,,,7_27_2020,,7997,,0.979141584,2,9/2/20 8:22,9/2/20 8:23,0,2,1,Smartphone,2,27,1,2,1,3,5,1,13,NH,1,1,1,1,2,2,2,2,0,0,0,0,1,0,0,0,0,0,0,0,0
D6W1Y2,2020-09-02T06:19:37Z,,2,2,screener,No,No,No,No,No,Yes,,,,,,,,,,,,,,,,,,,0,,,,0,,,,0,,,,0,,,,0,,,,0,,,,,,,,,,,,,,,,,,,,,,,,,,,,,,,,,,,,,,,,,,,,,,,,,7_27_2020,,23541,,0.606412138,2,9/2/20 8:19,9/2/20 8:21,0,2,1,Smartphone,1,67,4,6,1,5,4,1,16,MA,1,1,1,1,1,1,2,2,0,0,0,0,2,0,0,0,0,0,0,0,0
K8A9A0,2020-09-02T05:56:06Z,,1,1,no,No,No,No,No,No,No,1,5,1,1,1,1,2,0,1,2,0,0,2,0,3,11,0,1,1,,someone charged something on my card in a state  I didn't live in,Y,0,,,,0,,,,0,,,,0,,,,0,,,,0,,,,,0,,,,0,,,,0,,,,0,,,,0,,,,,,,,,,,,,,,,,,,No,,,,,,,3160,0.99965971,0.85163305,1,9/2/20 7:55,9/2/20 8:04,3,2,1,Smartphone,2,64,4,5,2,3,3,1,10,MD,3,5,1,1,1,1,2,1,0,0,0,0,1,0,0,0,0,0,0,0,0
F3U9D3,2020-09-02T00:53:43Z,,2,2,screener,No,No,No,No,No,No,,,,,,,,,,,,,,,,,,,0,,,,0,,,,0,,,,0,,,,0,,,,0,,,,,,,,,,,,,,,,,,,,,,,,,,,,,,,,,,,,,,,,,,,,,,,,,7_27_2020,,4142,,1.251132722,2,8/28/20 22:58,9/2/20 2:54,0,2,1,Desktop,1,27,1,2,4,3,6,2,5,OH,2,3,1,1,2,1,4,2,0,0,0,0,2,0,0,0,0,0,0,0,0
R8F8B2,2020-09-01T23:27:06Z,,2,2,screener,No,No,No,No,No,Yes,,,,,,,,,,,,,,,,,,,0,,,,0,,,,0,,,,0,,,,0,,,,0,,,,,,,,,,,,,,,,,,,,,,,,,,,,,,,,,,,,,,,,,,,,,,,,,7_27_2020,,11497,,0.531937422,2,9/2/20 0:26,9/2/20 0:29,0,2,1,Desktop,2,54,3,4,2,3,3,1,13,AL,3,6,1,1,1,1,2,4,0,0,1,0,3,0,0,0,0,0,0,0,0
Y2Q8V9,2020-09-01T21:57:10Z,,2,2,screener,No,No,No,No,No,Yes,,,,,,,,,,,,,,,,,,,0,,,,0,,,,0,,,,0,,,,0,,,,0,,,,,,,,,,,,,,,,,,,,,,,,,,,,,,,,,,,,,,,,,,,,,,,,,7_27_2020,,3941,,0.596079383,2,9/1/20 23:57,9/1/20 23:58,0,2,1,Desktop,2,50,3,4,4,3,3,1,9,FL,3,5,1,1,2,3,4,4,0,0,0,2,1,0,0,0,0,0,0,0,0
X8V7A4,2020-09-01T21:35:38Z,,2,2,screener,No,No,No,No,No,No,,,,,,,,,,,,,,,,,,,0,,,,0,,,,0,,,,0,,,,0,,,,0,,,,,,,,,,,,,,,,,,,,,,,,,,,,,,,,,,,,,,,,,,,,,,,,,7_27_2020,,23112,,1.238163983,2,9/1/20 23:35,9/1/20 23:36,0,2,1,Smartphone,2,51,3,4,4,3,1,6,7,NY,1,2,1,1,1,1,4,6,0,0,1,3,5,0,0,0,0,0,0,0,0
O5L1P5,2020-09-01T21:32:34Z,,2,2,screener,No,No,No,No,No,No,,,,,,,,,,,,,,,,,,,0,,,,0,,,,0,,,,0,,,,0,,,,0,,,,,,,,,,,,,,,,,,,,,,,,,,,,,,,,,,,,,,,,,,,,,,,,,7_27_2020,,28297,,3.102297482,2,9/1/20 23:32,9/1/20 23:34,1,2,1,Smartphone,2,42,2,3,2,1,5,6,1,IN,2,3,1,0,2,1,4,2,0,0,0,0,1,0,0,0,0,0,0,0,0
S4E9I7,2020-09-01T21:29:01Z,,1,1,no,No,No,No,No,No,No,5,5,5,5,5,5,0,0,1,0,1,0,0,0,0,1,0,0,0,,,,0,,,,0,,,,0,,,,0,,,,0,,,,1,N,no,,,0,,,,0,,,,0,,,,0,,,,0,,,,,,,,,,,,,,,,,,,,,,,,,,2259,0.624459594,1.484841447,1,9/1/20 20:28,9/1/20 20:32,0,2,1,Desktop,1,32,2,2,1,3,1,1,11,CO,4,8,1,1,1,2,4,3,0,0,0,0,3,0,0,0,0,0,0,0,0
R6E8B6,2020-09-01T21:23:56Z,,2,2,inconsistent,Yes,No,Yes,No,No,No,3,2,2,1,1,1,1,0,1,1,4,2,1,1,3,4,3,1,0,,,,0,,,,0,,,,0,,,,0,,,,0,,,,,,,,,,,,,,,,,,,,,,,,,,,,,,,,,,,,,,,,,,,,,,,,,7_27_2020,,14978,,2.799384949,2,9/1/20 22:23,9/1/20 22:27,0,2,1,Smartphone,2,39,2,3,2,1,5,4,4,IL,2,3,1,0,2,1,2,4,0,0,0,0,1,0,0,0,0,0,0,0,0
V0L4I2,2020-09-01T20:15:37Z,,2,2,screener,No,No,No,No,No,Yes,,,,,,,,,,,,,,,,,,,0,,,,0,,,,0,,,,0,,,,0,,,,0,,,,,,,,,,,,,,,,,,,,,,,,,,,,,,,,,,,,,,,,,,,,,,,,,7_27_2020,,7848,,0.797948266,2,8/29/20 18:02,9/1/20 22:17,0,2,1,Smartphone,2,33,2,2,1,3,1,7,10,TX,3,7,1,0,2,1,4,3,0,1,0,0,2,0,0,0,0,0,0,0,0
A2H0O4,2020-09-01T19:29:54Z,,2,1,no,No,Yes,No,No,No,Yes,5,5,5,3,5,5,0,0,0,0,0,1,0,0,1,0,1,0,0,,,,0,,,,0,,,,0,0,Paypal returned the funds to my account when I put in a fraud claim. Would have been $300,N,0,,,,0,,,,,,,,,,,,,,,,,,,,,,,,,,,,,,,,,,,,,,Yes,3,Very,,,,,,,,,,,14819,,0.71515283,1,9/1/20 21:29,9/1/20 21:36,1,2,1,Smartphone,2,46,3,4,1,4,1,1,11,GA,3,5,1,1,1,1,4,2,0,0,0,0,2,0,0,0,0,0,0,0,0
K8M6Q1,2020-09-01T19:14:48Z,,1,1,no,No,No,No,No,No,No,2,2,1,2,1,1,2,2,3,2,4,3,2,0,2,1,3,3,0,,,,0,,,,0,,,,0,,,,0,,,,0,,,,0,,,,,0,,,,0,,,,0,,,,0,,,,0,,,,,,,,,,,,,,,,,,,,,,,,,,2894,0.310138872,0.36734133,1,9/1/20 20:14,9/1/20 20:24,0,2,1,Desktop,1,55,3,5,1,5,1,1,16,NE,2,4,0,1,1,1,4,2,0,0,0,0,2,0,0,0,0,0,0,0,0
V5T7N2,2020-09-01T19:08:14Z,,2,2,screener,No,No,No,No,No,No,,,,,,,,,,,,,,,,,,,0,,,,0,,,,0,,,,0,,,,0,,,,0,,,,,,,,,,,,,,,,,,,,,,,,,,,,,,,,,,,,,,,,,,,,,,,,,7_27_2020,,21449,,0.793458503,2,8/21/20 12:21,9/1/20 20:09,0,2,1,Smartphone,2,32,2,2,1,3,1,1,11,WI,2,3,0,0,1,1,4,4,0,1,1,0,2,0,0,0,0,0,0,0,0
O4S0F7,2020-09-01T17:52:42Z,,2,2,screener,No,No,No,No,No,No,,,,,,,,,,,,,,,,,,,0,,,,0,,,,0,,,,0,,,,0,,,,0,,,,,,,,,,,,,,,,,,,,,,,,,,,,,,,,,,,,,,,,,,,,,,,,,7_27_2020,,19680,,0.853005105,2,9/1/20 19:52,9/1/20 19:53,0,2,1,Smartphone,1,41,2,3,1,3,1,2,18,GA,3,5,1,1,2,1,4,4,0,0,2,0,2,0,0,0,0,0,0,0,0
B2Y2Q0,2020-09-01T17:48:23Z,,2,2,screener,No,No,Yes,No,No,No,,,,,,,,,,,,,,,,,,,0,,,,0,,,,0,,,,0,,,,0,,,,0,,,,,,,,,,,,,,,,,,,,,,,,,,,,,,,,,,,,,,,,,,,,,,,,,7_27_2020,,28893,,0.535769742,2,9/1/20 19:48,9/1/20 19:48,0,2,1,Smartphone,2,57,3,5,2,3,6,4,5,GA,3,5,1,1,2,3,4,3,0,0,0,0,3,0,0,0,0,0,0,0,0
W0P3G7,2020-09-01T16:38:07Z,,2,2,inconsistent,Yes,No,Yes,No,No,Yes,5,5,5,5,5,5,0,0,0,2,1,1,1,0,1,1,1,1,0,,,,0,,,,0,,,,0,,,,0,,,,0,,,,,,,,,,,,,,,,,,,,,,,,,,,,,,,,,,,,,,,,,,,,,,,,,7_27_2020,,14663,,1.274342021,2,9/1/20 18:22,9/1/20 18:45,16,2,1,Smartphone,2,48,3,4,2,3,5,1,11,MA,1,1,1,1,1,1,2,1,0,0,0,0,1,0,0,0,0,0,0,0,0
E9Q7Q9,2020-09-01T16:24:54Z,,2,2,screener,No,No,No,No,No,No,,,,,,,,,,,,,,,,,,,0,,,,0,,,,0,,,,0,,,,0,,,,0,,,,,,,,,,,,,,,,,,,,,,,,,,,,,,,,,,,,,,,,,,,,,,,,,7_27_2020,,30929,,0.319400681,2,9/1/20 17:24,9/1/20 17:25,0,2,1,Desktop,1,59,3,5,1,4,1,1,18,NE,2,4,1,1,1,1,4,3,0,0,0,0,3,0,0,0,0,0,0,0,0
V4W7V1,2020-09-01T16:20:10Z,,2,2,screener,No,,No,,No,Yes,,,,,,,,,,,,,,,,,,,0,,,,0,,,,0,,,,0,,,,0,,,,0,,,,,,,,,,,,,,,,,,,,,,,,,,,,,,,,,,,,,,,,,,,,,,,,,7_27_2020,,22780,,0.9267579,2,9/1/20 18:20,9/1/20 18:21,0,2,1,Smartphone,2,51,3,4,2,2,6,1,7,OH,2,3,1,0,2,1,4,4,0,0,0,1,3,0,0,0,0,0,0,0,0
E5D9N0,2020-09-01T15:54:16Z,,2,2,screener,No,No,No,No,No,No,,,,,,,,,,,,,,,,,,,0,,,,0,,,,0,,,,0,,,,0,,,,0,,,,,,,,,,,,,,,,,,,,,,,,,,,,,,,,,,,,,,,,,,,,,,,,,7_27_2020,,19734,,0.366418109,2,9/1/20 16:53,9/1/20 16:55,0,2,1,Smartphone,2,40,2,3,1,4,5,1,12,MO,2,4,1,1,2,2,2,2,0,0,0,0,2,0,0,0,0,0,0,0,0
U0D8Y5,2020-09-01T15:52:59Z,,2,2,screener,No,No,Yes,No,No,No,,,,,,,,,,,,,,,,,,,0,,,,0,,,,0,,,,0,,,,0,,,,0,,,,,,,,,,,,,,,,,,,,,,,,,,,,,,,,,,,,,,,,,,,,,,,,,7_27_2020,,8598,,1.539578547,2,9/1/20 15:52,9/1/20 15:53,0,2,1,Smartphone,2,29,1,2,4,3,1,7,4,IN,2,3,1,1,2,4,4,5,0,2,0,0,2,0,0,0,0,0,0,0,0
P5U4W4,2020-09-01T15:42:08Z,,2,2,screener,No,No,No,No,No,No,,,,,,,,,,,,,,,,,,,0,,,,0,,,,0,,,,0,,,,0,,,,0,,,,,,,,,,,,,,,,,,,,,,,,,,,,,,,,,,,,,,,,,,,,,,,,,7_27_2020,,10567,,3.596577518,2,8/8/20 11:37,9/1/20 16:42,0,2,1,Smartphone,2,52,3,4,4,2,5,7,6,TX,3,7,1,0,3,4,4,6,0,0,1,2,3,0,0,0,0,0,0,0,0
Y0N1Q9,2020-09-01T15:06:36Z,,2,2,screener,No,No,No,No,No,No,,,,,,,,,,,,,,,,,,,0,,,,0,,,,0,,,,0,,,,0,,,,0,,,,,,,,,,,,,,,,,,,,,,,,,,,,,,,,,,,,,,,,,,,,,,,,,7_27_2020,,25574,,0.592409196,2,9/1/20 16:06,9/1/20 16:07,0,2,1,Desktop,2,42,2,3,1,3,6,5,11,AL,3,6,1,1,3,1,2,4,0,0,0,2,2,0,0,0,0,0,0,0,0
S0D9D4,2020-09-01T14:47:25Z,,2,2,screener,No,No,No,No,No,No,,,,,,,,,,,,,,,,,,,0,,,,0,,,,0,,,,0,,,,0,,,,0,,,,,,,,,,,,,,,,,,,,,,,,,,,,,,,,,,,,,,,,,,,,,,,,,7_27_2020,,29459,,0.491574055,2,9/1/20 16:47,9/1/20 16:49,0,2,1,Desktop,2,53,3,4,1,3,5,5,8,OH,2,3,1,1,1,1,2,1,0,0,0,0,1,0,0,0,0,0,0,0,0
T1K1D7,2020-09-01T14:45:26Z,,1,1,no,No,No,No,No,No,No,1,1,1,1,1,1,0,0,0,0,0,1,0,0,1,0,0,0,0,,,,0,,,,0,1750,My family thought we were IMHO to sent a home.  The Imam that we were dealing with never have ur keys to the good now if wants us to scan additional$100 so that he can send our new back to us,N,0,,,,0,,,,0,,,,0,,,,,0,,,,0,,,,0,,,,0,,,,0,,,,,,,,,,No,,,,,,,,,,,,,,,,2118,2.515810821,4.498829099,1,8/16/20 11:47,9/1/20 17:36,1,2,1,Smartphone,2,46,3,4,4,2,1,4,3,TX,3,7,1,0,2,1,4,3,0,0,0,1,2,0,0,0,0,0,0,0,0
A9J3Q0,2020-09-01T14:21:13Z,,2,2,screener,No,No,No,No,No,Yes,,,,,,,,,,,,,,,,,,,0,,,,0,,,,0,,,,0,,,,0,,,,0,,,,,,,,,,,,,,,,,,,,,,,,,,,,,,,,,,,,,,,,,,,,,,,,,7_27_2020,,25740,,0.310403486,2,9/1/20 15:21,9/1/20 15:22,0,2,1,Desktop,1,70,4,6,1,5,1,2,6,IL,2,3,1,1,1,3,2,2,0,0,0,0,2,0,0,0,0,0,0,0,0
E3Z9X6,2020-09-01T14:03:11Z,,2,2,screener,No,No,No,No,No,No,,,,,,,,,,,,,,,,,,,0,,,,0,,,,0,,,,0,,,,0,,,,0,,,,,,,,,,,,,,,,,,,,,,,,,,,,,,,,,,,,,,,,,,,,,,,,,7_27_2020,,23019,,1.040085054,2,9/1/20 15:03,9/1/20 15:04,0,2,1,Desktop,1,72,4,6,1,2,1,5,11,FL,3,5,1,1,1,1,2,2,0,0,0,0,2,0,0,0,0,0,0,0,0
K0A9J9,2020-09-01T13:27:58Z,,2,2,screener,No,No,No,No,No,No,,,,,,,,,,,,,,,,,,,0,,,,0,,,,0,,,,0,,,,0,,,,0,,,,,,,,,,,,,,,,,,,,,,,,,,,,,,,,,,,,,,,,,,,,,,,,,7_27_2020,,18339,,0.448513344,2,9/1/20 12:27,9/1/20 12:28,0,2,1,Desktop,1,65,4,6,1,5,3,2,16,CA,4,9,1,1,2,3,2,1,0,0,0,0,1,0,0,0,0,0,0,0,0
X2D5N8,2020-09-01T13:21:52Z,,2,2,screener,No,No,No,No,No,No,,,,,,,,,,,,,,,,,,,0,,,,0,,,,0,,,,0,,,,0,,,,0,,,,,,,,,,,,,,,,,,,,,,,,,,,,,,,,,,,,,,,,,,,,,,,,,7_27_2020,,23564,,0.815251248,2,9/1/20 13:21,9/1/20 13:22,0,2,1,Desktop,2,29,1,2,1,5,6,1,8,MN,2,4,1,1,2,3,4,2,0,0,0,0,2,0,0,0,0,0,0,0,0
U0H5S7,2020-09-01T11:37:20Z,,2,2,screener,No,No,No,No,No,No,,,,,,,,,,,,,,,,,,,0,,,,0,,,,0,,,,0,,,,0,,,,0,,,,,,,,,,,,,,,,,,,,,,,,,,,,,,,,,,,,,,,,,,,,,,,,,7_27_2020,,19352,,1.108852243,2,8/19/20 15:57,9/1/20 10:38,0,2,1,Desktop,1,39,2,3,1,4,5,2,6,CA,4,9,1,1,2,3,4,1,0,0,0,0,1,0,0,0,0,0,0,0,0
W0T8J4,2020-09-01T11:27:18Z,,2,2,screener,No,,No,No,No,Yes,,,,,,,,,,,,,,,,,,,0,,,,0,,,,0,,,,0,,,,0,,,,0,,,,,,,,,,,,,,,,,,,,,,,,,,,,,,,,,,,,,,,,,,,,,,,,,7_27_2020,,14800,,0.637224097,2,9/1/20 10:27,9/1/20 10:28,0,2,1,Desktop,1,61,4,5,1,4,2,1,13,NV,4,8,1,1,1,1,4,1,0,0,0,0,1,0,0,0,0,0,0,0,0
N8M4M8,2020-09-01T09:23:14Z,,2,2,screener,No,No,No,No,No,No,,,,,,,,,,,,,,,,,,,0,,,,0,,,,0,,,,0,,,,0,,,,0,,,,,,,,,,,,,,,,,,,,,,,,,,,,,,,,,,,,,,,,,,,,,,,,,7_27_2020,,13786,,0.674775151,2,9/1/20 10:23,9/1/20 10:23,0,2,1,Desktop,2,30,2,2,1,3,1,1,9,WI,2,3,0,1,1,1,4,6,0,2,4,0,2,0,0,0,0,0,0,0,0
G4L5E5,2020-09-01T09:21:11Z,,2,2,screener,No,No,No,No,No,No,,,,,,,,,,,,,,,,,,,0,,,,0,,,,0,,,,0,,,,0,,,,0,,,,,,,,,,,,,,,,,,,,,,,,,,,,,,,,,,,,,,,,,,,,,,,,,7_27_2020,,27384,,0.8920105,2,9/1/20 10:20,9/1/20 10:22,0,2,1,Desktop,2,60,4,5,1,2,1,7,6,TX,3,7,1,1,1,1,4,3,0,0,0,0,3,0,0,0,0,0,0,0,0
V4U2X4,2020-09-01T08:50:15Z,,2,2,screener,No,No,No,No,No,Yes,,,,,,,,,,,,,,,,,,,0,,,,0,,,,0,,,,0,,,,0,,,,0,,,,,,,,,,,,,,,,,,,,,,,,,,,,,,,,,,,,,,,,,,,,,,,,,7_27_2020,,19416,,0.425444591,2,9/1/20 10:50,9/1/20 10:50,0,2,1,Desktop,2,67,4,6,1,4,1,1,10,DE,3,5,1,1,1,1,3,2,0,0,0,0,2,0,0,0,0,0,0,0,0
M1Q1N1,2020-09-01T08:16:03Z,,2,2,screener,No,No,No,No,No,Yes,,,,,,,,,,,,,,,,,,,0,,,,0,,,,0,,,,0,,,,0,,,,0,,,,,,,,,,,,,,,,,,,,,,,,,,,,,,,,,,,,,,,,,,,,,,,,,7_27_2020,,6702,,1.941581305,2,9/1/20 7:15,9/1/20 7:16,0,2,1,Desktop,2,31,2,2,4,2,1,1,10,AZ,4,8,1,1,2,1,4,6,0,0,5,1,2,0,0,0,0,0,0,0,0
W1G3C0,2020-09-01T08:14:04Z,,2,2,screener,No,No,No,No,No,No,,,,,,,,,,,,,,,,,,,0,,,,0,,,,0,,,,0,,,,0,,,,0,,,,,,,,,,,,,,,,,,,,,,,,,,,,,,,,,,,,,,,,,,,,,,,,,7_27_2020,,17096,,1.182510301,2,9/1/20 10:13,9/1/20 10:15,0,2,1,Desktop,1,36,2,3,1,5,1,2,14,MD,3,5,1,1,1,1,4,4,0,0,0,0,4,0,0,0,0,0,0,0,0
I0Q5S9,2020-09-01T08:08:43Z,,2,2,screener,No,No,Yes,No,No,No,,,,,,,,,,,,,,,,,,,0,,,,0,,,,0,,,,0,,,,0,,,,0,,,,,,,,,,,,,,,,,,,,,,,,,,,,,,,,,,,,,,,,,,,,,,,,,7_27_2020,,17387,,0.521446133,2,9/1/20 9:08,9/1/20 9:11,0,2,1,Smartphone,1,53,3,4,1,3,6,1,8,MS,3,6,0,0,1,4,4,3,0,0,0,0,3,0,0,0,0,0,0,0,0
F4Z5W5,2020-09-01T07:38:10Z,,2,2,screener,No,No,No,No,No,No,,,,,,,,,,,,,,,,,,,0,,,,0,,,,0,,,,0,,,,0,,,,0,,,,,,,,,,,,,,,,,,,,,,,,,,,,,,,,,,,,,,,,,,,,,,,,,7_27_2020,,5785,,1.812727724,2,9/1/20 8:38,9/1/20 8:38,0,2,1,Desktop,1,30,2,2,1,4,1,1,4,FL,3,5,1,0,1,1,4,1,0,0,0,0,1,0,0,0,0,0,0,0,0
T7V0D9,2020-09-01T07:13:22Z,,2,2,screener,No,No,No,No,No,Yes,,,,,,,,,,,,,,,,,,,0,,,,0,,,,0,,,,0,,,,0,,,,0,,,,,,,,,,,,,,,,,,,,,,,,,,,,,,,,,,,,,,,,,,,,,,,,,7_27_2020,,12103,,1.616589266,2,9/1/20 9:12,9/1/20 9:15,1,2,1,Smartphone,1,69,4,6,4,4,1,5,13,ME,1,1,1,1,1,1,4,2,0,0,0,0,1,0,0,0,0,0,0,0,0
X4Y1K5,2020-09-01T06:43:41Z,,2,2,screener,No,No,Yes,,No,Yes,,,,,,,,,,,,,,,,,,,0,,,,0,,,,0,,,,0,,,,0,,,,0,,,,,,,,,,,,,,,,,,,,,,,,,,,,,,,,,,,,,,,,,,,,,,,,,7_27_2020,,15856,,0.756815591,2,9/1/20 8:43,9/1/20 8:45,0,2,1,Smartphone,2,50,3,4,1,3,3,6,1,NJ,1,2,1,1,2,3,2,2,0,0,0,0,2,0,0,0,0,0,0,0,0
X8K5I0,2020-09-01T06:16:24Z,,2,2,screener,No,No,No,No,No,Yes,,,,,,,,,,,,,,,,,,,0,,,,0,,,,0,,,,0,,,,0,,,,0,,,,,,,,,,,,,,,,,,,,,,,,,,,,,,,,,,,,,,,,,,,,,,,,,7_27_2020,,25930,,2.237561735,2,9/1/20 7:15,9/1/20 7:32,1,2,1,Smartphone,2,43,2,3,1,1,6,7,5,WI,2,3,1,0,1,2,4,4,0,0,0,0,4,0,0,0,0,0,0,0,0
S5S8U0,2020-09-01T05:51:13Z,,2,2,screener,No,No,No,No,No,No,,,,,,,,,,,,,,,,,,,0,,,,0,,,,0,,,,0,,,,0,,,,0,,,,,,,,,,,,,,,,,,,,,,,,,,,,,,,,,,,,,,,,,,,,,,,,,7_27_2020,,12136,,2.199811722,2,9/1/20 6:51,9/1/20 6:52,0,2,1,Smartphone,1,77,4,7,2,1,3,5,5,TX,3,7,1,1,2,1,4,3,0,0,0,0,3,0,0,0,0,0,0,0,0
U2J7B9,2020-08-31T21:25:40Z,,2,2,screener,No,No,No,No,No,No,,,,,,,,,,,,,,,,,,,0,,,,0,,,,0,,,,0,,,,0,,,,0,,,,,,,,,,,,,,,,,,,,,,,,,,,,,,,,,,,,,,,,,,,,,,,,,7_27_2020,,25804,,4.124605787,2,8/31/20 23:25,8/31/20 23:26,0,2,1,Smartphone,2,36,2,3,2,2,5,4,9,NY,1,2,1,0,1,4,3,6,0,0,0,0,1,0,0,0,0,0,0,0,0
O1Y8E0,2020-08-31T20:49:52Z,,2,2,screener,No,No,No,No,No,No,,,,,,,,,,,,,,,,,,,0,,,,0,,,,0,,,,0,,,,0,,,,0,,,,,,,,,,,,,,,,,,,,,,,,,,,,,,,,,,,,,,,,,,,,,,,,,7_27_2020,,6642,,0.340976696,2,8/31/20 21:49,8/31/20 21:51,0,2,1,Desktop,2,57,3,5,1,5,1,6,13,IL,2,3,1,1,1,1,4,4,0,0,0,1,3,0,0,0,0,0,0,0,0
U6H5O9,2020-08-31T19:52:12Z,,2,2,screener,No,No,No,No,No,Yes,,,,,,,,,,,,,,,,,,,0,,,,0,,,,0,,,,0,,,,0,,,,0,,,,,,,,,,,,,,,,,,,,,,,,,,,,,,,,,,,,,,,,,,,,,,,,,7_27_2020,,13552,,1.658097893,2,8/31/20 21:51,8/31/20 21:54,1,2,1,Smartphone,2,47,3,4,4,3,6,1,5,FL,3,5,1,1,2,3,4,4,0,0,0,0,4,0,0,0,0,0,0,0,0
G1D3X9,2020-08-31T19:17:45Z,,2,2,screener,No,No,No,No,No,No,,,,,,,,,,,,,,,,,,,0,,,,0,,,,0,,,,0,,,,0,,,,0,,,,,,,,,,,,,,,,,,,,,,,,,,,,,,,,,,,,,,,,,,,,,,,,,7_27_2020,,21949,,2.52405746,2,8/31/20 20:17,8/31/20 20:19,1,2,1,Smartphone,2,54,3,4,2,2,1,6,4,AL,3,6,1,1,1,1,4,3,0,0,0,0,3,0,0,0,0,0,0,0,0
V1I1J5,2020-08-31T18:59:01Z,,1,1,no,No,No,No,No,No,No,5,5,5,5,5,5,0,0,1,0,1,1,1,0,0,0,1,0,0,,,,0,,,,0,,,,0,,,,0,,,,0,,,,0,,,,,1,Y,75,Buying something off etsy,0,,,,0,,,,0,,,,0,,,,,,,,,,,,,,,,,,,,,,,,,,3851,0.194388252,0.994219947,1,8/31/20 20:58,8/31/20 21:03,1,2,1,Smartphone,1,33,2,2,1,3,1,1,13,NY,1,2,1,1,1,1,4,2,0,0,0,0,2,0,0,0,1,0,0,0,0
I3Y1C8,2020-08-31T18:17:12Z,,2,2,inconsistent,Yes,No,Yes,No,No,No,3,1,1,1,2,1,1,1,1,0,1,0,2,0,1,0,1,3,0,,,,0,,,,0,,,,0,,,,0,,,,0,,,,,,,,,,,,,,,,,,,,,,,,,,,,,,,,,,,,,,,,,,,,,,,,,7_27_2020,,6037,,1.389742752,2,8/12/20 4:08,9/1/20 0:07,1,2,1,Smartphone,1,53,3,4,1,2,5,2,5,CA,4,9,1,1,1,5,1,6,0,0,0,1,6,0,0,0,0,0,0,0,0
Z2X1R7,2020-08-31T17:47:01Z,,2,2,screener,No,No,No,No,No,No,,,,,,,,,,,,,,,,,,,0,,,,0,,,,0,,,,0,,,,0,,,,0,,,,,,,,,,,,,,,,,,,,,,,,,,,,,,,,,,,,,,,,,,,,,,,,,7_27_2020,,30581,,0.754369343,2,8/31/20 19:46,8/31/20 19:48,0,2,1,Smartphone,2,32,2,2,1,3,1,7,10,OH,2,3,0,1,1,1,4,6,2,2,1,0,2,0,0,0,0,0,0,0,0
U1Y1U7,2020-08-31T17:29:25Z,,1,1,no,No,No,No,No,No,Yes,5,5,5,5,3,5,1,1,1,0,0,1,0,0,2,0,1,2,1,,Unauthorized charges,Y,0,,,,0,,,,0,,,,0,,,,0,,,,3,Y,Unauthorized charges,,500,0,,,,0,,,,0,,,,0,,,,0,,,,,,,,,,,,,,,,,,,No,,,,,,0,3218,0.530564584,1.058567137,1,8/31/20 19:29,8/31/20 19:40,0,2,1,Smartphone,1,45,3,4,2,5,4,1,9,SC,3,5,1,1,2,3,3,1,0,0,0,0,1,0,3,0,0,0,0,0,0
J3D3B7,2020-08-31T17:22:03Z,,1,1,no,No,No,No,,No,No,1,3,1,2,2,2,0,0,2,0,2,1,1,1,0,0,1,0,0,,,,1,10,Ordered from wish.com never got the product,Y,0,,,,0,,,,0,,,,0,,,,0,N,no,,0,0,N,,No,0,,,,0,,,,0,,,,0,,,,,,,,,,,,,,,,,,,,,,,,,0,3244,1.531695569,1.715925218,1,8/31/20 16:22,8/31/20 16:29,0,2,1,Smartphone,2,35,2,3,1,2,5,7,9,OR,4,9,1,1,2,3,4,3,0,0,0,0,3,0,0,0,0,0,0,0,0
N7V7S4,2020-08-31T17:17:01Z,,1,1,no,No,No,No,No,No,Yes,2,3,3,1,3,2,0,0,1,0,0,0,1,1,0,0,0,0,1,,We went on a trip to Texas.  Then somehow after we werer already back home someone tried to use our debit account at a Walmart.  Luckily the bank caught it and we were refunded and issued new cards.,Y,0,,,,0,,,,0,,,,0,,,,0,,,,0,,,,,0,,,,0,,,,0,,,,0,,,,0,,,,,,,,,,,,,,,,,,,No,,,,,,,2225,0.204073422,0.364198829,1,8/27/20 11:37,8/31/20 17:29,1,2,1,Smartphone,2,35,2,3,1,3,1,6,9,CO,4,8,1,1,3,2,4,2,0,0,0,0,2,0,0,0,0,0,0,0,0
V7Z1H4,2020-08-31T16:33:57Z,,2,2,screener,No,No,No,No,No,No,,,,,,,,,,,,,,,,,,,0,,,,0,,,,0,,,,0,,,,0,,,,0,,,,,,,,,,,,,,,,,,,,,,,,,,,,,,,,,,,,,,,,,,,,,,,,,7_27_2020,,23997,,0.434339572,2,8/31/20 17:33,8/31/20 17:35,0,2,1,Desktop,2,67,4,6,1,5,1,5,18,TX,3,7,1,1,1,1,4,2,0,0,0,0,2,0,0,0,0,0,0,0,0
R3F9T1,2020-08-31T16:29:50Z,,2,2,screener,No,No,No,No,No,No,,,,,,,,,,,,,,,,,,,0,,,,0,,,,0,,,,0,,,,0,,,,0,,,,,,,,,,,,,,,,,,,,,,,,,,,,,,,,,,,,,,,,,,,,,,,,,7_27_2020,,6928,,0.528158206,2,8/4/20 19:15,8/31/20 17:30,0,2,1,Desktop,2,35,2,3,5,5,5,1,9,KS,2,4,1,1,2,1,4,1,0,0,0,0,1,0,0,0,0,0,0,0,0
C2R2C0,2020-08-31T15:47:39Z,,2,2,screener,No,No,No,No,No,Yes,,,,,,,,,,,,,,,,,,,0,,,,0,,,,0,,,,0,,,,0,,,,0,,,,,,,,,,,,,,,,,,,,,,,,,,,,,,,,,,,,,,,,,,,,,,,,,7_27_2020,,18182,,0.673280338,2,8/31/20 16:47,8/31/20 16:49,0,2,1,Desktop,2,52,3,4,1,3,1,2,18,TN,3,6,1,1,1,1,2,6,0,0,1,0,5,0,0,0,0,0,0,0,0
E3U8E7,2020-08-31T15:34:33Z,,2,2,screener,No,No,No,No,No,No,,,,,,,,,,,,,,,,,,,0,,,,0,,,,0,,,,0,,,,0,,,,0,,,,,,,,,,,,,,,,,,,,,,,,,,,,,,,,,,,,,,,,,,,,,,,,,7_27_2020,,15416,,0.370418792,2,8/31/20 15:33,8/31/20 15:48,1,2,1,Desktop,2,68,4,6,1,3,3,5,3,NM,4,8,1,1,2,3,4,1,0,0,0,0,1,0,0,0,0,0,0,0,0
U8U5N3,2020-08-31T15:04:27Z,,2,2,screener,No,No,No,No,No,No,,,,,,,,,,,,,,,,,,,0,,,,0,,,,0,,,,0,,,,0,,,,0,,,,,,,,,,,,,,,,,,,,,,,,,,,,,,,,,,,,,,,,,,,,,,,,,7_27_2020,,23180,,0.873541358,2,8/31/20 17:04,8/31/20 17:05,1,2,1,Desktop,2,58,3,5,6,4,1,5,17,MI,2,3,1,1,1,1,2,2,0,0,0,0,2,0,0,0,0,0,0,0,0
T2O3C1,2020-08-31T14:29:15Z,,2,2,screener,No,No,No,No,No,Yes,,,,,,,,,,,,,,,,,,,0,,,,0,,,,0,,,,0,,,,0,,,,0,,,,,,,,,,,,,,,,,,,,,,,,,,,,,,,,,,,,,,,,,,,,,,,,,7_27_2020,,16673,,0.622616941,2,8/31/20 15:29,8/31/20 15:31,0,2,1,Desktop,2,67,4,6,1,2,1,5,12,SD,2,4,1,0,3,4,4,2,0,0,0,0,2,0,0,0,0,0,0,0,0
E1K5O3,2020-08-31T14:25:10Z,,2,2,screener,No,No,No,No,No,No,,,,,,,,,,,,,,,,,,,0,,,,0,,,,0,,,,0,,,,0,,,,0,,,,,,,,,,,,,,,,,,,,,,,,,,,,,,,,,,,,,,,,,,,,,,,,,7_27_2020,,21019,,2.114338328,2,8/31/20 16:24,8/31/20 16:26,0,2,1,Smartphone,2,43,2,3,1,2,1,6,7,IN,2,3,1,1,1,4,4,6,0,0,0,3,2,0,0,0,0,0,0,0,0
F5O3W0,2020-08-31T14:25:08Z,,2,2,screener,No,No,No,No,No,No,,,,,,,,,,,,,,,,,,,0,,,,0,,,,0,,,,0,,,,0,,,,0,,,,,,,,,,,,,,,,,,,,,,,,,,,,,,,,,,,,,,,,,,,,,,,,,7_27_2020,,30422,,0.666415192,2,8/31/20 16:24,8/31/20 16:27,0,2,1,Desktop,1,84,4,7,1,5,1,5,15,NY,1,2,1,1,1,1,3,2,0,0,0,0,2,0,0,0,0,0,0,0,0
V5R6Q7,2020-08-31T14:02:49Z,,2,2,screener,No,No,No,No,No,No,,,,,,,,,,,,,,,,,,,0,,,,0,,,,0,,,,0,,,,0,,,,0,,,,,,,,,,,,,,,,,,,,,,,,,,,,,,,,,,,,,,,,,,,,,,,,,7_27_2020,,11083,,0.805000944,2,8/5/20 14:35,8/31/20 13:03,1,2,1,Desktop,2,25,1,2,4,3,5,1,18,CA,4,9,1,1,2,3,4,6,0,0,1,0,5,0,0,0,0,0,0,0,0
Y4L9T9,2020-08-31T13:41:47Z,,2,2,screener,No,No,No,No,No,No,,,,,,,,,,,,,,,,,,,0,,,,0,,,,0,,,,0,,,,0,,,,0,,,,,,,,,,,,,,,,,,,,,,,,,,,,,,,,,,,,,,,,,,,,,,,,,7_27_2020,,18750,,0.296536459,2,8/31/20 12:41,8/31/20 12:42,0,2,1,Desktop,2,65,4,6,1,4,3,5,11,CA,4,9,1,1,1,1,4,1,0,0,0,0,1,0,0,0,0,0,0,0,0
N1E8X9,2020-08-31T13:15:40Z,,2,2,screener,No,No,Yes,No,No,No,,,,,,,,,,,,,,,,,,,0,,,,0,,,,0,,,,0,,,,0,,,,0,,,,,,,,,,,,,,,,,,,,,,,,,,,,,,,,,,,,,,,,,,,,,,,,,7_27_2020,,16452,,0.734967669,2,8/31/20 15:15,8/31/20 15:16,0,2,1,Smartphone,2,52,3,4,2,3,3,1,9,IN,2,3,0,1,2,2,2,2,0,0,0,1,1,0,0,0,0,0,0,0,0
C1K9N7,2020-08-31T13:04:58Z,,2,2,screener,No,No,No,No,No,No,,,,,,,,,,,,,,,,,,,0,,,,0,,,,0,,,,0,,,,0,,,,0,,,,,,,,,,,,,,,,,,,,,,,,,,,,,,,,,,,,,,,,,,,,,,,,,7_27_2020,,26259,,0.421740374,2,8/31/20 14:04,8/31/20 14:06,1,2,1,Smartphone,1,62,4,5,1,3,1,1,11,TN,3,6,0,1,1,1,4,2,0,0,0,0,2,0,0,0,0,0,0,0,0
S5J4C5,2020-08-31T12:17:16Z,,2,2,inconsistent,Yes,Yes,Yes,No,No,Yes,2,3,3,4,4,4,1,3,2,1,1,1,1,2,1,2,1,1,0,,,,0,,,,0,100,Product sent does not match description,N,0,,,,0,,,,0,,,,,,,,,,,,,,,,,,,,,,,,,,,,,,,,,,,,,,,,,,,,,,,,,,,12269,,2.928974472,2,8/31/20 11:16,8/31/20 11:19,0,2,1,Desktop,1,27,1,2,6,4,6,1,15,CA,4,9,1,1,2,2,2,2,0,0,0,0,1,0,0,0,0,0,0,0,0
L8A5M3,2020-08-31T12:02:55Z,,2,2,screener,No,No,No,No,No,No,,,,,,,,,,,,,,,,,,,0,,,,0,,,,0,,,,0,,,,0,,,,0,,,,,,,,,,,,,,,,,,,,,,,,,,,,,,,,,,,,,,,,,,,,,,,,,7_27_2020,,27221,,0.499582548,2,8/31/20 14:02,8/31/20 14:03,0,2,1,Desktop,1,73,4,6,1,5,1,2,13,GA,3,5,1,1,1,1,2,2,0,0,0,0,2,0,0,0,0,0,0,0,0
O4B7J9,2020-08-31T11:37:03Z,,2,2,screener,No,No,No,,No,Yes,,,,,,,,,,,,,,,,,,,0,,,,0,,,,0,,,,0,,,,0,,,,0,,,,,,,,,,,,,,,,,,,,,,,,,,,,,,,,,,,,,,,,,,,,,,,,,7_27_2020,,27676,,0.43097493,2,8/31/20 12:36,8/31/20 12:39,1,2,1,Smartphone,2,47,3,4,3,3,4,1,12,AL,3,6,1,0,3,2,4,5,0,1,2,0,2,0,0,0,0,0,0,0,0
R5Z9D6,2020-08-31T11:21:12Z,,2,2,screener,No,No,No,No,No,No,,,,,,,,,,,,,,,,,,,0,,,,0,,,,0,,,,0,,,,0,,,,0,,,,,,,,,,,,,,,,,,,,,,,,,,,,,,,,,,,,,,,,,,,,,,,,,7_27_2020,,11088,,2.252138442,2,8/31/20 13:20,8/31/20 13:23,1,2,1,Smartphone,1,26,1,2,2,3,5,1,5,PA,1,2,1,1,2,1,4,5,0,0,0,0,5,0,0,0,0,0,0,0,0
U0N1O1,2020-08-31T11:08:04Z,,2,2,screener,,,,,,,,,,,,,,,,,,,,,,,,,0,,,,0,,,,0,,,,0,,,,0,,,,0,,,,,,,,,,,,,,,,,,,,,,,,,,,,,,,,,,,,,,,,,,,,,,,,,7_27_2020,,28216,,0.688667744,2,8/31/20 12:07,8/31/20 12:08,0,2,1,Smartphone,2,36,2,3,2,3,6,1,5,GA,3,5,1,0,3,3,4,6,0,2,1,0,3,0,0,0,0,0,0,0,0
S5J7I8,2020-08-31T10:41:24Z,,2,2,screener,No,No,No,No,No,Yes,,,,,,,,,,,,,,,,,,,0,,,,0,,,,0,,,,0,,,,0,,,,0,,,,,,,,,,,,,,,,,,,,,,,,,,,,,,,,,,,,,,,,,,,,,,,,,7_27_2020,,28625,,3.6711671,2,8/31/20 12:41,8/31/20 12:42,0,2,1,Smartphone,2,44,2,3,2,2,1,1,12,TN,3,6,1,1,1,1,4,2,0,0,0,0,2,0,0,0,0,0,0,0,0
A2G6E9,2020-08-31T10:19:29Z,,2,2,screener,No,No,No,No,No,Yes,,,,,,,,,,,,,,,,,,,0,,,,0,,,,0,,,,0,,,,0,,,,0,,,,,,,,,,,,,,,,,,,,,,,,,,,,,,,,,,,,,,,,,,,,,,,,,7_27_2020,,28025,,0.413980353,2,8/31/20 11:19,8/31/20 11:20,0,2,1,Desktop,1,65,4,6,1,4,1,5,13,TN,3,6,1,1,1,1,4,2,0,0,0,0,2,0,0,0,0,0,0,0,0
V3S8R1,2020-08-31T10:16:03Z,,2,2,screener,No,No,No,No,No,No,,,,,,,,,,,,,,,,,,,0,,,,0,,,,0,,,,0,,,,0,,,,0,,,,,,,,,,,,,,,,,,,,,,,,,,,,,,,,,,,,,,,,,,,,,,,,,7_27_2020,,5008,,0.935646521,2,8/17/20 12:02,8/31/20 11:16,0,2,1,Desktop,2,34,2,2,1,4,1,1,18,TN,3,6,1,1,1,1,4,2,0,0,0,0,2,0,0,0,0,0,0,0,0
R0E6W0,2020-08-31T10:07:08Z,,2,2,screener,No,No,Yes,No,No,Yes,,,,,,,,,,,,,,,,,,,0,,,,0,,,,0,,,,0,,,,0,,,,0,,,,,,,,,,,,,,,,,,,,,,,,,,,,,,,,,,,,,,,,,,,,,,,,,7_27_2020,,24539,,0.225288402,2,8/31/20 12:06,8/31/20 12:09,1,2,1,Desktop,2,64,4,5,1,4,1,2,9,CT,1,1,1,1,2,3,3,2,0,0,0,0,2,0,0,0,0,0,0,0,0
M4J5B4,2020-08-31T10:02:11Z,,2,2,screener,No,No,Yes,No,,No,,,,,,,,,,,,,,,,,,,0,,,,0,,,,0,,,,0,,,,0,,,,0,,,,,,,,,,,,,,,,,,,,,,,,,,,,,,,,,,,,,,,,,,,,,,,,,7_27_2020,,27169,,2.190012197,2,8/31/20 11:01,8/31/20 11:03,0,2,1,Smartphone,1,57,3,5,1,2,1,1,10,MS,3,6,0,0,1,4,4,3,0,0,0,0,3,0,0,0,0,0,0,0,0
T7R9X7,2020-08-31T10:02:07Z,,2,2,inconsistent,Yes,No,No,No,No,Yes,1,4,3,1,1,3,1,3,4,3,3,4,2,3,2,1,3,3,0,,,,0,,,,0,,,,0,,,,0,,,,0,,,,,,,,,,,,,,,,,,,,,,,,,,,,,,,,,,,,,,,,,,,,,,,,,7_27_2020,,26874,,0.54174823,2,8/31/20 9:01,8/31/20 9:09,1,2,1,Desktop,1,78,4,7,3,4,1,5,10,CA,4,9,1,1,1,1,2,2,0,0,0,0,2,0,0,0,0,0,0,0,0
V4W5S0,2020-08-31T09:53:26Z,,2,2,screener,No,No,No,No,No,No,,,,,,,,,,,,,,,,,,,0,,,,0,,,,0,,,,0,,,,0,,,,0,,,,,,,,,,,,,,,,,,,,,,,,,,,,,,,,,,,,,,,,,,,,,,,,,7_27_2020,,14794,,0.411542711,2,8/31/20 10:53,8/31/20 10:54,0,2,1,Desktop,1,69,4,6,1,4,1,5,15,TX,3,7,1,1,1,1,3,3,0,0,0,0,3,0,0,0,0,0,0,0,0
J9A8Q6,2020-08-31T09:51:17Z,,2,2,screener,No,No,No,No,No,No,,,,,,,,,,,,,,,,,,,0,,,,0,,,,0,,,,0,,,,0,,,,0,,,,,,,,,,,,,,,,,,,,,,,,,,,,,,,,,,,,,,,,,,,,,,,,,7_27_2020,,16027,,1.2319894,2,8/31/20 11:51,8/31/20 11:52,0,2,1,Smartphone,2,27,1,2,1,4,5,2,4,MI,2,3,1,1,2,3,4,2,0,0,0,0,2,0,0,0,0,0,0,0,0
H1I5A4,2020-08-31T08:47:10Z,,2,2,screener,No,No,No,No,No,No,,,,,,,,,,,,,,,,,,,0,,,,0,,,,0,,,,0,,,,0,,,,0,,,,,,,,,,,,,,,,,,,,,,,,,,,,,,,,,,,,,,,,,,,,,,,,,7_27_2020,,18690,,0.720132994,2,8/31/20 10:47,8/31/20 10:47,0,2,1,Desktop,2,42,2,3,1,4,4,2,9,GA,3,5,1,1,1,1,4,4,0,0,1,1,2,0,0,0,0,0,0,0,0
S7R7S1,2020-08-31T08:39:11Z,,2,1,no,Yes,No,No,No,No,Yes,4,4,4,4,3,4,0,0,0,0,1,2,1,0,1,1,1,2,0,,,,0,,,,0,20,I ordered a pair of damage resistant gloves and they never came,N,0,,,,0,,,,0,,,,,,,,,,,,,,,,,,,,,,,,,,,,,,,,,,,No,,,,,,,,,,,,,,,,22694,,0.574192118,1,8/31/20 10:38,8/31/20 10:44,2,2,1,Smartphone,1,39,2,3,1,4,6,1,9,TN,3,6,1,1,2,3,4,2,0,0,0,0,2,0,0,0,0,0,0,0,0
V8Q3X0,2020-08-31T07:18:42Z,,2,2,screener,No,No,No,No,No,No,,,,,,,,,,,,,,,,,,,0,,,,0,,,,0,,,,0,,,,0,,,,0,,,,,,,,,,,,,,,,,,,,,,,,,,,,,,,,,,,,,,,,,,,,,,,,,7_27_2020,,14482,,0.414488724,2,8/31/20 8:18,8/31/20 8:19,0,2,1,Desktop,1,73,4,6,1,4,1,5,12,TX,3,7,0,1,1,1,4,2,0,0,0,0,2,0,0,0,0,0,0,0,0
C3H3G9,2020-08-31T06:57:09Z,,2,2,screener,No,No,No,No,No,No,,,,,,,,,,,,,,,,,,,0,,,,0,,,,0,,,,0,,,,0,,,,0,,,,,,,,,,,,,,,,,,,,,,,,,,,,,,,,,,,,,,,,,,,,,,,,,7_27_2020,,29992,,0.65292297,2,8/31/20 7:56,8/31/20 7:58,0,2,1,Desktop,2,44,2,3,1,3,3,1,14,IL,2,3,1,1,2,3,4,3,0,0,0,1,1,0,0,0,0,0,0,0,0
Q2C3K0,2020-08-31T05:57:31Z,,2,2,screener,No,No,No,No,No,No,,,,,,,,,,,,,,,,,,,0,,,,0,,,,0,,,,0,,,,0,,,,0,,,,,,,,,,,,,,,,,,,,,,,,,,,,,,,,,,,,,,,,,,,,,,,,,7_27_2020,,15194,,3.402835393,2,8/31/20 7:57,8/31/20 7:59,1,2,1,Smartphone,1,45,3,4,1,2,5,6,2,DE,3,5,1,0,3,1,2,1,0,0,0,0,1,0,0,0,0,0,0,0,0
O6I2C3,2020-08-31T05:54:35Z,,2,2,screener,No,No,No,No,No,No,,,,,,,,,,,,,,,,,,,0,,,,0,,,,0,,,,0,,,,0,,,,0,,,,,,,,,,,,,,,,,,,,,,,,,,,,,,,,,,,,,,,,,,,,,,,,,7_27_2020,,14269,,1.643203041,2,8/31/20 7:53,8/31/20 7:56,1,2,1,Smartphone,2,55,3,5,1,2,1,6,4,ME,1,1,0,0,1,4,4,2,0,0,0,0,2,0,0,0,0,0,0,0,0
Q6I9L3,2020-08-31T05:19:24Z,,2,2,screener,No,No,No,No,No,Yes,,,,,,,,,,,,,,,,,,,0,,,,0,,,,0,,,,0,,,,0,,,,0,,,,,,,,,,,,,,,,,,,,,,,,,,,,,,,,,,,,,,,,,,,,,,,,,7_27_2020,,29796,,3.429640493,2,8/31/20 7:19,8/31/20 7:21,0,2,1,Smartphone,1,54,3,4,1,1,3,1,13,GA,3,5,0,1,1,1,4,1,0,0,0,0,1,0,0,0,0,0,0,0,0
X6U4K9,2020-08-31T03:14:34Z,,2,2,screener,No,No,No,No,No,Yes,,,,,,,,,,,,,,,,,,,0,,,,0,,,,0,,,,0,,,,0,,,,0,,,,,,,,,,,,,,,,,,,,,,,,,,,,,,,,,,,,,,,,,,,,,,,,,7_27_2020,,11385,,0.486407634,2,8/31/20 4:14,8/31/20 4:17,0,2,1,Smartphone,2,61,4,5,2,3,2,1,13,KS,2,4,1,1,1,1,4,2,0,0,0,0,2,0,0,0,0,0,0,0,0
O0W3F9,2020-08-31T02:42:45Z,,2,2,screener,No,No,No,No,No,No,,,,,,,,,,,,,,,,,,,0,,,,0,,,,0,,,,0,,,,0,,,,0,,,,,,,,,,,,,,,,,,,,,,,,,,,,,,,,,,,,,,,,,,,,,,,,,7_27_2020,,600,,1.027187362,2,8/31/20 1:42,8/31/20 1:43,0,2,1,Smartphone,2,23,1,1,1,3,5,1,14,CA,4,9,1,1,1,1,4,5,0,0,0,0,5,0,0,0,0,0,0,0,0
J0J4P3,2020-08-31T00:34:44Z,,2,2,screener,No,No,No,No,No,No,,,,,,,,,,,,,,,,,,,0,,,,0,,,,0,,,,0,,,,0,,,,0,,,,,,,,,,,,,,,,,,,,,,,,,,,,,,,,,,,,,,,,,,,,,,,,,7_27_2020,,3896,,3.886132855,2,8/31/20 2:33,8/31/20 2:35,2,2,1,Smartphone,2,25,1,2,1,2,5,2,5,OH,2,3,1,1,1,1,1,2,0,0,0,0,2,0,0,0,0,0,0,0,0
M7T6V2,2020-08-30T23:29:24Z,,2,2,screener,No,No,No,No,No,No,,,,,,,,,,,,,,,,,,,0,,,,0,,,,0,,,,0,,,,0,,,,0,,,,,,,,,,,,,,,,,,,,,,,,,,,,,,,,,,,,,,,,,,,,,,,,,7_27_2020,,22909,,0.862784232,2,8/30/20 22:28,8/30/20 22:31,1,2,1,Smartphone,2,64,4,5,2,5,4,4,11,CA,4,9,1,1,1,1,4,4,0,1,0,0,3,0,0,0,0,0,0,0,0
G0V3Q9,2020-08-30T23:18:50Z,,2,2,screener,No,No,No,No,No,No,,,,,,,,,,,,,,,,,,,0,,,,0,,,,0,,,,0,,,,0,,,,0,,,,,,,,,,,,,,,,,,,,,,,,,,,,,,,,,,,,,,,,,,,,,,,,,7_27_2020,,24780,,0.213701749,2,8/31/20 0:18,8/31/20 0:24,1,2,1,Desktop,1,76,4,7,1,3,1,5,12,TX,3,7,1,1,1,1,2,5,0,0,0,0,5,0,0,0,0,0,0,0,0
E9W8B7,2020-08-30T22:08:37Z,,2,2,screener,No,No,No,No,No,No,,,,,,,,,,,,,,,,,,,0,,,,0,,,,0,,,,0,,,,0,,,,0,,,,,,,,,,,,,,,,,,,,,,,,,,,,,,,,,,,,,,,,,,,,,,,,,7_27_2020,,512,,1.018185428,2,8/30/20 21:08,8/30/20 21:09,0,2,1,Smartphone,2,32,2,2,4,2,1,1,12,CA,4,9,1,1,2,1,4,6,0,0,2,2,2,0,0,0,0,0,0,0,0
I1J1B4,2020-08-30T21:41:24Z,,2,2,screener,,No,No,,No,Yes,,,,,,,,,,,,,,,,,,,0,,,,0,,,,0,,,,0,,,,0,,,,0,,,,,,,,,,,,,,,,,,,,,,,,,,,,,,,,,,,,,,,,,,,,,,,,,7_27_2020,,19015,,0.880980458,2,8/30/20 22:40,8/30/20 22:43,1,2,1,Smartphone,2,40,2,3,5,3,6,2,14,AR,3,7,0,0,3,1,4,6,0,0,0,0,6,0,0,0,0,0,0,0,0
Z9S4O6,2020-08-30T21:21:26Z,,2,2,screener,No,No,No,No,No,No,,,,,,,,,,,,,,,,,,,0,,,,0,,,,0,,,,0,,,,0,,,,0,,,,,,,,,,,,,,,,,,,,,,,,,,,,,,,,,,,,,,,,,,,,,,,,,7_27_2020,,15136,,0.415795742,2,8/30/20 22:21,8/30/20 22:22,0,2,1,Smartphone,2,52,3,4,1,3,1,1,6,AL,3,6,1,0,1,1,4,6,0,0,0,2,4,0,0,0,0,0,0,0,0
N2D6Z4,2020-08-30T21:14:56Z,,2,2,screener,,No,No,No,No,Yes,,,,,,,,,,,,,,,,,,,0,,,,0,,,,0,,,,0,,,,0,,,,0,,,,,,,,,,,,,,,,,,,,,,,,,,,,,,,,,,,,,,,,,,,,,,,,,7_27_2020,,26689,,0.633211154,2,8/30/20 23:14,8/30/20 23:15,0,2,1,Smartphone,1,66,4,6,1,3,1,1,13,MD,3,5,1,1,1,5,4,3,0,0,0,0,3,0,0,0,0,0,0,0,0
Z8K0X3,2020-08-30T21:08:42Z,,2,1,no,Yes,No,No,No,No,No,4,3,4,3,3,3,,,,,1,4,0,0,7,2,4,0,0,,,,0,,,,0,,,,0,,,,0,,,,0,,,,,,,,,,,,,,,,,,,,,,,,,,,,,,,,,,,,,,,,,,,,,,,,,,,8177,,2.319622836,1,8/30/20 22:08,8/30/20 22:09,0,2,1,Smartphone,2,41,2,3,2,2,3,1,3,TX,3,7,0,1,1,1,4,3,0,0,0,1,2,0,0,0,0,0,0,0,0
I5L2K3,2020-08-30T19:46:06Z,,2,2,inconsistent,No,Yes,No,No,No,No,4,4,3,2,3,4,0,0,0,0,1,1,1,1,0,0,0,0,0,,,,0,,,,0,,,,0,,,,0,,,,0,,,,,,,,,,,,,,,,,,,,,,,,,,,,,,,,,,,,,,,,,,,,,,,,,7_27_2020,,13271,,1.823998805,2,8/30/20 21:45,8/30/20 21:54,1,2,1,Smartphone,1,36,2,3,4,3,1,1,14,PA,1,2,1,1,1,1,4,6,0,4,2,0,3,0,0,0,0,0,0,0,0
M0U4B3,2020-08-30T19:01:48Z,,2,2,screener,No,No,No,No,No,No,,,,,,,,,,,,,,,,,,,0,,,,0,,,,0,,,,0,,,,0,,,,0,,,,,,,,,,,,,,,,,,,,,,,,,,,,,,,,,,,,,,,,,,,,,,,,,7_27_2020,,20524,,1.413336679,2,8/30/20 21:01,8/30/20 21:02,0,2,1,Smartphone,1,38,2,3,1,3,1,1,10,NY,1,2,1,1,3,1,2,5,0,0,2,1,2,0,0,0,0,0,0,0,0
P2D8L1,2020-08-30T18:28:49Z,,2,2,screener,No,No,No,No,No,No,,,,,,,,,,,,,,,,,,,0,,,,0,,,,0,,,,0,,,,0,,,,0,,,,,,,,,,,,,,,,,,,,,,,,,,,,,,,,,,,,,,,,,,,,,,,,,7_27_2020,,9281,,1.302151343,2,8/25/20 7:48,8/30/20 19:29,1,2,1,Smartphone,2,24,1,1,1,3,5,1,15,TX,3,7,1,1,1,1,2,6,0,0,0,0,1,0,0,0,0,0,0,0,0
H5D1D6,2020-08-30T17:26:31Z,,2,2,screener,No,No,No,No,No,No,,,,,,,,,,,,,,,,,,,0,,,,0,,,,0,,,,0,,,,0,,,,0,,,,,,,,,,,,,,,,,,,,,,,,,,,,,,,,,,,,,,,,,,,,,,,,,7_27_2020,,8076,,0.559795487,2,8/30/20 16:25,8/30/20 16:28,1,2,1,Smartphone,2,37,2,3,4,3,6,6,9,AZ,4,8,1,0,2,3,4,6,0,0,0,2,2,0,0,0,0,0,0,0,0
P5G7V4,2020-08-30T16:30:24Z,,2,1,no,No,Yes,No,No,No,Yes,3,3,2,3,2,2,3,0,2,0,1,3,2,1,5,1,0,1,0,,,,0,,,,0,,,,0,,,,0,,,,0,,,,,,,,,,,,,,,,,,,,,,,,,,,,,,,,,,,,,,,,,,,,,,,,,,,26651,,1.463502341,1,8/30/20 18:30,8/30/20 18:33,1,2,1,Desktop,2,60,4,5,1,2,1,6,13,NJ,1,2,1,1,1,1,2,1,0,0,0,0,1,0,0,0,0,0,0,0,0
C9S4Z4,2020-08-30T16:05:28Z,,2,2,screener,No,No,No,No,No,No,,,,,,,,,,,,,,,,,,,0,,,,0,,,,0,,,,0,,,,0,,,,0,,,,,,,,,,,,,,,,,,,,,,,,,,,,,,,,,,,,,,,,,,,,,,,,,7_27_2020,,17456,,0.316398835,2,8/30/20 18:05,8/30/20 18:06,0,2,1,Desktop,1,79,4,7,1,5,5,5,8,MI,2,3,0,1,1,1,3,1,0,0,0,0,1,0,0,0,0,0,0,0,0
G2T3V1,2020-08-30T15:49:42Z,,2,2,inconsistent,No,Yes,No,No,No,Yes,5,5,5,5,3,4,0,2,2,1,4,3,1,2,0,2,4,2,0,,,,0,,,,0,,,,0,,,,0,,,,0,,,,,,,,,,,,,,,,,,,,,,,,,,,,,,,,,,,,,,,,,,,,,,,,,7_27_2020,,14001,,1.364280276,2,8/30/20 17:49,8/30/20 17:52,0,2,1,Smartphone,1,35,2,3,1,5,1,1,14,TN,3,6,1,1,1,1,4,2,0,0,0,0,1,0,0,0,0,0,0,0,0
Y7F7J2,2020-08-30T15:33:05Z,,2,2,screener,No,No,No,No,No,Yes,,,,,,,,,,,,,,,,,,,0,,,,0,,,,0,,,,0,,,,0,,,,0,,,,,,,,,,,,,,,,,,,,,,,,,,,,,,,,,,,,,,,,,,,,,,,,,7_27_2020,,9492,,0.377926946,2,8/30/20 17:32,8/30/20 17:34,1,2,1,Desktop,2,60,4,5,1,4,1,7,18,FL,3,5,1,1,1,1,2,4,0,0,0,0,4,0,0,0,0,0,0,0,0
C5R4E7,2020-08-30T14:51:58Z,,2,2,inconsistent,Yes,Yes,Yes,Yes,Yes,Yes,3,1,1,1,2,2,1,1,1,1,1,1,0,0,2,1,2,2,0,,,,0,,,,0,,,,0,,,,0,5000,World winner they steal your money and make you think you are playing real individuals but they have been saying they are USING BOTS TO RUN AND YOU LOSER YOUR MONEY,N,0,,,,,,,,,,,,,,,,,,,,,,,,,,,,,,,,,,,,,,,,,,,,,,,,,,,30425,,1.96535806,2,8/30/20 16:51,8/30/20 16:55,0,2,1,Smartphone,1,36,2,3,1,1,1,1,10,MI,2,3,0,0,2,1,1,6,0,0,1,0,6,0,0,0,0,0,0,0,0
Y0J5Q2,2020-08-30T14:18:57Z,,2,2,screener,No,No,Yes,No,No,No,,,,,,,,,,,,,,,,,,,0,,,,0,,,,0,,,,0,,,,0,,,,0,,,,,,,,,,,,,,,,,,,,,,,,,,,,,,,,,,,,,,,,,,,,,,,,,7_27_2020,,30023,,0.545022326,2,8/30/20 13:18,8/30/20 13:21,1,2,1,Smartphone,2,52,3,4,2,3,1,2,5,CA,4,9,1,1,2,2,2,6,0,0,0,0,7,0,0,0,0,0,0,0,0
X6G6G5,2020-08-30T13:50:54Z,,2,2,screener,No,No,Yes,No,No,Yes,,,,,,,,,,,,,,,,,,,0,,,,0,,,,0,,,,0,,,,0,,,,0,,,,,,,,,,,,,,,,,,,,,,,,,,,,,,,,,,,,,,,,,,,,,,,,,7_27_2020,,30917,,1.144343121,2,8/30/20 14:50,8/30/20 14:51,0,2,1,Smartphone,2,26,1,2,1,4,5,2,2,MO,2,4,0,1,2,1,4,1,0,0,0,0,1,0,0,0,0,0,0,0,0
F6Y3V1,2020-08-30T13:11:15Z,,2,2,screener,No,No,No,No,No,Yes,,,,,,,,,,,,,,,,,,,0,,,,0,,,,0,,,,0,,,,0,,,,0,,,,,,,,,,,,,,,,,,,,,,,,,,,,,,,,,,,,,,,,,,,,,,,,,7_27_2020,,11688,,0.457925911,2,8/30/20 12:11,8/30/20 12:13,0,2,1,Desktop,1,30,2,2,5,4,5,2,14,CA,4,9,1,1,2,3,2,3,0,0,0,0,3,0,0,0,0,0,0,0,0
Q2P9Y4,2020-08-30T13:10:41Z,,2,2,screener,No,No,No,No,No,No,,,,,,,,,,,,,,,,,,,0,,,,0,,,,0,,,,0,,,,0,,,,0,,,,,,,,,,,,,,,,,,,,,,,,,,,,,,,,,,,,,,,,,,,,,,,,,7_27_2020,,14923,,0.966603381,2,8/30/20 12:10,8/30/20 12:12,0,2,1,Desktop,1,48,3,4,5,3,1,1,14,AZ,4,8,1,1,1,1,2,4,0,0,0,0,1,0,0,0,0,0,0,0,0
Y1B4S7,2020-08-30T12:22:17Z,,2,2,screener,No,No,No,No,No,No,,,,,,,,,,,,,,,,,,,0,,,,0,,,,0,,,,0,,,,0,,,,0,,,,,,,,,,,,,,,,,,,,,,,,,,,,,,,,,,,,,,,,,,,,,,,,,7_27_2020,,18014,,0.542734992,2,8/30/20 14:21,8/30/20 14:23,0,2,1,Smartphone,2,64,4,5,3,3,3,5,6,VA,3,5,1,0,2,1,4,1,0,0,0,0,1,0,0,0,0,0,0,0,0
X8B2U3,2020-08-30T12:08:39Z,,2,2,screener,No,No,No,No,No,No,,,,,,,,,,,,,,,,,,,0,,,,0,,,,0,,,,0,,,,0,,,,0,,,,,,,,,,,,,,,,,,,,,,,,,,,,,,,,,,,,,,,,,,,,,,,,,7_27_2020,,18344,,1.951139468,2,8/30/20 13:08,8/30/20 13:09,0,2,1,Desktop,1,91,4,7,5,1,1,5,9,MO,2,4,1,1,3,1,3,2,0,0,0,0,1,0,0,0,0,0,0,0,0
F8P7P6,2020-08-30T11:55:23Z,,2,2,screener,No,No,No,No,No,No,,,,,,,,,,,,,,,,,,,0,,,,0,,,,0,,,,0,,,,0,,,,0,,,,,,,,,,,,,,,,,,,,,,,,,,,,,,,,,,,,,,,,,,,,,,,,,7_27_2020,,22869,,0.266786572,2,8/30/20 13:55,8/30/20 13:56,0,2,1,Smartphone,2,53,3,4,1,4,4,6,5,GA,3,5,1,1,2,4,4,2,0,0,0,0,2,0,0,0,0,0,0,0,0
O9Q2R2,2020-08-30T11:41:26Z,,2,1,no,Yes,No,Yes,No,No,Yes,5,5,5,4,5,4,1,0,0,0,2,3,5,1,1,1,2,1,0,,,,0,,,,0,1700,Down payment toward a house and there was no such house,N,0,,,,0,,,,0,,,,,,,,,,,,,,,,,,,,,,,,,,,,,,,,,,,No,,,,,,,,,,,,,,,,13429,,0.851537943,1,8/30/20 13:41,8/30/20 13:47,1,2,1,Smartphone,2,62,4,5,1,2,6,6,6,NH,1,1,1,1,2,3,2,3,0,0,0,0,3,0,0,0,0,0,0,0,0
Q7O3H7,2020-08-30T11:09:22Z,,2,2,inconsistent,Yes,Yes,Yes,No,No,Yes,5,1,5,1,5,5,0,1,1,0,1,1,1,1,2,2,1,1,0,,,,0,,,,0,,,,0,,,,0,,,,0,,,,,,,,,,,,,,,,,,,,,,,,,,,,,,,,,,,,,,,,,,,,,,,,,7_27_2020,,11356,,0.644843537,2,8/30/20 12:08,8/30/20 12:17,1,2,1,Desktop,1,81,4,7,5,3,1,5,4,TX,3,7,0,1,1,1,1,2,0,0,0,0,2,0,0,0,0,0,0,0,0
X5X1S6,2020-08-30T11:07:22Z,,2,2,screener,No,No,No,No,No,No,,,,,,,,,,,,,,,,,,,0,,,,0,,,,0,,,,0,,,,0,,,,0,,,,,,,,,,,,,,,,,,,,,,,,,,,,,,,,,,,,,,,,,,,,,,,,,7_27_2020,,19874,,2.557804141,2,8/30/20 13:06,8/30/20 13:08,1,2,1,Desktop,1,27,1,2,6,5,5,1,13,NY,1,2,1,1,2,3,4,6,0,0,0,0,6,0,0,0,0,0,0,0,0
S9R2S0,2020-08-30T10:56:34Z,,2,2,screener,No,No,No,No,No,No,,,,,,,,,,,,,,,,,,,0,,,,0,,,,0,,,,0,,,,0,,,,0,,,,,,,,,,,,,,,,,,,,,,,,,,,,,,,,,,,,,,,,,,,,,,,,,7_27_2020,,20953,,2.472888103,2,8/30/20 12:56,8/30/20 12:58,1,2,1,Smartphone,2,30,2,2,1,2,6,7,7,VA,3,5,1,1,2,1,4,3,0,0,0,0,2,0,0,0,0,0,0,0,0
J9R4V6,2020-08-30T10:10:39Z,,2,2,screener,No,No,No,No,No,No,,,,,,,,,,,,,,,,,,,0,,,,0,,,,0,,,,0,,,,0,,,,0,,,,,,,,,,,,,,,,,,,,,,,,,,,,,,,,,,,,,,,,,,,,,,,,,7_27_2020,,9205,,0.474167559,2,8/30/20 12:10,8/30/20 12:12,0,2,1,Desktop,1,83,4,7,4,5,3,5,9,FL,3,5,1,1,1,1,1,1,0,0,0,0,1,0,0,0,0,0,0,0,0
Y3X1O5,2020-08-30T09:45:17Z,,2,2,screener,No,No,No,No,No,No,,,,,,,,,,,,,,,,,,,0,,,,0,,,,0,,,,0,,,,0,,,,0,,,,,,,,,,,,,,,,,,,,,,,,,,,,,,,,,,,,,,,,,,,,,,,,,7_27_2020,,10321,,0.84654261,2,8/30/20 9:45,8/30/20 9:46,0,2,1,Desktop,2,65,4,6,4,4,5,1,9,CO,4,8,1,1,1,2,2,1,0,0,0,0,1,0,0,0,0,0,0,0,0
P4Y0D1,2020-08-30T08:28:51Z,,2,1,no,Yes,Yes,No,No,No,Yes,4,5,5,4,4,5,1,2,1,0,1,3,1,0,2,0,1,1,0,,,,0,,,,0,,,,1,400,sold old iphone online and shipped to address but never got paid,Y,0,,,,0,,,,,,,,,,,,,,,,,,,,,,,,,,,,,,,,,,,,,,No,,,,,,,,,,,,,18643,,0.375189201,1,8/30/20 10:28,8/30/20 10:35,2,2,1,Desktop,2,60,4,5,1,5,1,1,16,MI,2,3,1,0,1,1,4,4,0,0,0,0,4,0,0,0,0,0,0,0,0
T5X4Q7,2020-08-30T08:02:41Z,,2,2,screener,No,No,No,No,No,Yes,,,,,,,,,,,,,,,,,,,0,,,,0,,,,0,,,,0,,,,0,,,,0,,,,,,,,,,,,,,,,,,,,,,,,,,,,,,,,,,,,,,,,,,,,,,,,,7_27_2020,,10265,,1.063427551,2,8/29/20 23:01,8/30/20 7:03,0,2,1,Smartphone,2,32,2,2,5,2,6,1,1,CA,4,9,1,1,2,3,4,3,0,0,0,0,2,0,0,0,0,0,0,0,0
M3D8I8,2020-08-30T07:03:28Z,,2,2,screener,No,No,No,No,No,No,,,,,,,,,,,,,,,,,,,0,,,,0,,,,0,,,,0,,,,0,,,,0,,,,,,,,,,,,,,,,,,,,,,,,,,,,,,,,,,,,,,,,,,,,,,,,,7_27_2020,,23754,,0.657780521,2,8/30/20 9:01,8/30/20 9:04,2,2,1,Desktop,2,25,1,2,5,4,5,1,8,RI,1,1,1,1,2,1,4,2,0,0,0,0,2,0,0,0,0,0,0,0,0
L3E4B4,2020-08-30T05:03:31Z,,2,2,screener,No,No,No,No,No,,,,,,,,,,,,,,,,,,,,0,,,,0,,,,0,,,,0,,,,0,,,,0,,,,,,,,,,,,,,,,,,,,,,,,,,,,,,,,,,,,,,,,,,,,,,,,,7_27_2020,,18839,,0.874126759,2,8/30/20 6:03,8/30/20 6:17,1,2,1,Smartphone,2,53,3,4,1,2,2,1,11,WI,2,3,0,1,1,1,4,2,0,0,0,0,2,0,0,0,0,0,0,0,0
R3W7Q2,2020-08-30T00:05:55Z,,2,2,screener,No,No,No,No,No,No,,,,,,,,,,,,,,,,,,,0,,,,0,,,,0,,,,0,,,,0,,,,0,,,,,,,,,,,,,,,,,,,,,,,,,,,,,,,,,,,,,,,,,,,,,,,,,7_27_2020,,6077,,0.632754578,2,8/29/20 23:02,8/29/20 23:12,2,2,1,Smartphone,2,58,3,5,2,3,1,6,4,CA,4,9,1,1,2,1,3,4,0,0,0,0,4,0,0,0,0,0,0,0,0
C9M6T1,2020-08-29T21:59:24Z,,2,2,screener,No,No,No,No,No,Yes,,,,,,,,,,,,,,,,,,,0,,,,0,,,,0,,,,0,,,,0,,,,0,,,,,,,,,,,,,,,,,,,,,,,,,,,,,,,,,,,,,,,,,,,,,,,,,7_27_2020,,17116,,0.351044175,2,8/29/20 21:59,8/29/20 22:01,0,2,1,Smartphone,2,61,4,5,1,3,1,5,13,NM,4,8,1,1,1,1,4,2,0,0,0,0,1,0,0,0,0,0,0,0,0
D9L9Z5,2020-08-29T21:52:29Z,,2,2,screener,,No,No,No,No,Yes,,,,,,,,,,,,,,,,,,,0,,,,0,,,,0,,,,0,,,,0,,,,0,,,,,,,,,,,,,,,,,,,,,,,,,,,,,,,,,,,,,,,,,,,,,,,,,7_27_2020,,21919,,0.665895327,2,8/29/20 22:51,8/29/20 22:53,1,2,1,Smartphone,2,61,4,5,1,3,1,1,13,TX,3,7,1,0,1,4,4,2,0,0,0,0,2,0,0,0,0,0,0,0,0
Z2U9O8,2020-08-29T21:01:46Z,,2,2,screener,No,No,No,No,No,Yes,,,,,,,,,,,,,,,,,,,0,,,,0,,,,0,,,,0,,,,0,,,,0,,,,,,,,,,,,,,,,,,,,,,,,,,,,,,,,,,,,,,,,,,,,,,,,,7_27_2020,,27453,,0.274137247,2,8/29/20 23:01,8/29/20 23:02,0,2,1,Desktop,2,52,3,4,1,4,5,1,10,VA,3,5,1,1,3,1,2,1,0,0,0,0,1,0,0,0,0,0,0,0,0
G6W8J8,2020-08-29T21:00:58Z,,2,2,screener,No,No,No,No,No,No,,,,,,,,,,,,,,,,,,,0,,,,0,,,,0,,,,0,,,,0,,,,0,,,,,,,,,,,,,,,,,,,,,,,,,,,,,,,,,,,,,,,,,,,,,,,,,7_27_2020,,22344,,0.982305332,2,8/29/20 19:59,8/29/20 20:02,2,2,1,Desktop,2,36,2,3,1,4,1,1,15,WA,4,9,1,1,1,1,2,5,0,0,0,0,1,0,0,0,0,0,0,0,0
D9B1I1,2020-08-29T20:54:03Z,,2,2,screener,No,No,No,No,No,No,,,,,,,,,,,,,,,,,,,0,,,,0,,,,0,,,,0,,,,0,,,,0,,,,,,,,,,,,,,,,,,,,,,,,,,,,,,,,,,,,,,,,,,,,,,,,,7_27_2020,,25931,,2.972960073,2,8/29/20 22:54,8/29/20 22:54,0,2,1,Smartphone,2,30,2,2,1,1,6,1,8,PA,1,2,1,1,2,1,4,2,0,0,0,0,2,0,0,0,0,0,0,0,0
B8S6P7,2020-08-29T20:42:09Z,,2,2,screener,No,No,No,No,No,No,,,,,,,,,,,,,,,,,,,0,,,,0,,,,0,,,,0,,,,0,,,,0,,,,,,,,,,,,,,,,,,,,,,,,,,,,,,,,,,,,,,,,,,,,,,,,,7_27_2020,,14235,,0.287486621,2,8/29/20 22:41,8/29/20 22:43,1,2,1,Desktop,2,64,4,5,1,4,1,5,11,MA,1,1,1,1,1,1,1,2,0,0,0,0,2,0,0,0,0,0,0,0,0
I0U4U8,2020-08-29T20:40:49Z,,2,2,screener,No,No,No,No,No,No,,,,,,,,,,,,,,,,,,,0,,,,0,,,,0,,,,0,,,,0,,,,0,,,,,,,,,,,,,,,,,,,,,,,,,,,,,,,,,,,,,,,,,,,,,,,,,7_27_2020,,30997,,0.286619132,2,8/18/20 19:22,8/29/20 19:41,1,2,1,Desktop,2,71,4,6,1,5,3,5,2,CA,4,9,1,1,2,2,3,1,0,0,0,0,1,0,0,0,0,0,0,0,0
L5I5H0,2020-08-29T19:06:53Z,,2,2,screener,,,,,,,,,,,,,,,,,,,,,,,,,0,,,,0,,,,0,,,,0,,,,0,,,,0,,,,,,,,,,,,,,,,,,,,,,,,,,,,,,,,,,,,,,,,,,,,,,,,,7_27_2020,,21842,,0.428028008,2,8/29/20 20:06,8/29/20 20:08,0,2,1,Smartphone,2,61,4,5,3,3,1,1,16,IL,2,3,1,1,1,1,2,6,0,0,0,0,6,0,0,0,0,0,0,0,0
K5P8N5,2020-08-29T18:24:00Z,,2,2,screener,No,No,No,No,No,Yes,,,,,,,,,,,,,,,,,,,0,,,,0,,,,0,,,,0,,,,0,,,,0,,,,,,,,,,,,,,,,,,,,,,,,,,,,,,,,,,,,,,,,,,,,,,,,,7_27_2020,,26445,,2.99487604,2,8/29/20 20:23,8/29/20 20:24,0,2,1,Desktop,2,19,1,1,6,4,5,1,14,FL,3,5,1,1,1,1,4,4,0,0,0,1,3,0,0,0,0,0,0,0,0
Q7M3V8,2020-08-29T18:21:49Z,,2,2,screener,No,No,No,No,No,No,,,,,,,,,,,,,,,,,,,0,,,,0,,,,0,,,,0,,,,0,,,,0,,,,,,,,,,,,,,,,,,,,,,,,,,,,,,,,,,,,,,,,,,,,,,,,,7_27_2020,,28469,,1.11879832,2,8/29/20 17:21,8/29/20 17:23,1,2,1,Desktop,1,62,4,5,3,5,1,1,17,WA,4,9,1,1,1,1,4,2,0,0,0,0,2,0,0,0,0,0,0,0,0
M7C4K7,2020-08-29T17:31:48Z,,2,2,screener,No,No,No,No,No,Yes,,,,,,,,,,,,,,,,,,,0,,,,0,,,,0,,,,0,,,,0,,,,0,,,,,,,,,,,,,,,,,,,,,,,,,,,,,,,,,,,,,,,,,,,,,,,,,7_27_2020,,13537,,0.564110629,2,8/29/20 16:31,8/29/20 16:33,0,2,1,Desktop,1,69,4,6,1,3,1,5,12,OR,4,9,1,1,1,4,4,2,0,0,0,0,2,0,0,0,0,0,0,0,0
G3F2U1,2020-08-29T17:24:40Z,,2,2,screener,No,No,No,No,No,No,,,,,,,,,,,,,,,,,,,0,,,,0,,,,0,,,,0,,,,0,,,,0,,,,,,,,,,,,,,,,,,,,,,,,,,,,,,,,,,,,,,,,,,,,,,,,,7_27_2020,,31302,,1.406055636,2,8/29/20 16:24,8/29/20 16:26,0,2,1,Desktop,2,58,3,5,1,2,3,1,10,OR,4,9,1,1,1,1,4,1,0,0,0,0,1,0,0,0,0,0,0,0,0
I7U5K1,2020-08-29T17:14:54Z,,2,2,screener,No,No,No,No,No,Yes,,,,,,,,,,,,,,,,,,,0,,,,0,,,,0,,,,0,,,,0,,,,0,,,,,,,,,,,,,,,,,,,,,,,,,,,,,,,,,,,,,,,,,,,,,,,,,7_27_2020,,15162,,0.248513686,2,8/29/20 16:14,8/29/20 16:21,0,2,1,Desktop,2,54,3,4,1,3,1,1,13,CA,4,9,1,1,2,3,4,4,0,0,0,0,4,0,0,0,0,0,0,0,0
V4H4R4,2020-08-29T16:41:12Z,,2,2,screener,No,No,No,No,No,Yes,,,,,,,,,,,,,,,,,,,0,,,,0,,,,0,,,,0,,,,0,,,,0,,,,,,,,,,,,,,,,,,,,,,,,,,,,,,,,,,,,,,,,,,,,,,,,,7_27_2020,,25824,,0.579199061,2,8/29/20 16:40,8/29/20 16:42,1,2,1,Smartphone,2,40,2,3,1,3,1,7,11,PA,1,2,1,1,2,1,2,6,0,0,2,4,2,0,0,0,0,0,0,0,0
P9T8J7,2020-08-29T15:02:54Z,,2,2,screener,No,,No,No,No,No,,,,,,,,,,,,,,,,,,,0,,,,0,,,,0,,,,0,,,,0,,,,0,,,,,,,,,,,,,,,,,,,,,,,,,,,,,,,,,,,,,,,,,,,,,,,,,7_27_2020,,14364,,1.7953711,2,8/29/20 17:02,8/29/20 17:03,0,2,1,Smartphone,2,43,2,3,1,2,1,1,3,IN,2,3,0,1,2,1,4,5,0,0,0,0,3,0,0,0,0,0,0,0,0
G3S8V0,2020-08-29T14:02:36Z,,2,2,screener,No,No,Yes,No,No,No,,,,,,,,,,,,,,,,,,,0,,,,0,,,,0,,,,0,,,,0,,,,0,,,,,,,,,,,,,,,,,,,,,,,,,,,,,,,,,,,,,,,,,,,,,,,,,7_27_2020,,25592,,1.167990387,2,8/18/20 18:50,8/29/20 15:03,1,2,1,Smartphone,2,48,3,4,1,3,5,2,6,TX,3,7,1,1,1,1,4,2,0,0,0,0,2,0,0,0,0,0,0,0,0
P8O7Y0,2020-08-29T13:58:53Z,,2,2,screener,No,No,No,No,No,Yes,,,,,,,,,,,,,,,,,,,0,,,,0,,,,0,,,,0,,,,0,,,,0,,,,,,,,,,,,,,,,,,,,,,,,,,,,,,,,,,,,,,,,,,,,,,,,,7_27_2020,,23956,,0.494882877,2,8/29/20 13:58,8/29/20 13:59,0,2,1,Smartphone,2,30,2,2,1,3,5,1,3,NM,4,8,1,1,2,2,4,2,0,0,0,0,2,0,0,0,0,0,0,0,0
V2D5I9,2020-08-29T13:04:19Z,,2,2,screener,No,No,No,No,No,No,,,,,,,,,,,,,,,,,,,0,,,,0,,,,0,,,,0,,,,0,,,,0,,,,,,,,,,,,,,,,,,,,,,,,,,,,,,,,,,,,,,,,,,,,,,,,,7_27_2020,,17448,,0.836306922,2,8/29/20 15:04,8/29/20 15:05,0,2,1,Smartphone,2,53,3,4,1,3,1,1,13,TN,3,6,1,1,1,1,4,3,0,0,0,0,3,0,0,0,0,0,0,0,0
Q6J9R2,2020-08-29T12:36:17Z,,2,2,screener,No,No,No,No,No,No,,,,,,,,,,,,,,,,,,,0,,,,0,,,,0,,,,0,,,,0,,,,0,,,,,,,,,,,,,,,,,,,,,,,,,,,,,,,,,,,,,,,,,,,,,,,,,7_27_2020,,16371,,0.508364657,2,8/29/20 14:36,8/29/20 14:37,0,2,1,Desktop,2,68,4,6,1,5,1,5,13,MD,3,5,0,1,1,1,2,2,0,0,0,0,2,0,0,0,0,0,0,0,0
P4M6F6,2020-08-29T12:29:32Z,,2,2,screener,No,No,No,No,No,No,,,,,,,,,,,,,,,,,,,0,,,,0,,,,0,,,,0,,,,0,,,,0,,,,,,,,,,,,,,,,,,,,,,,,,,,,,,,,,,,,,,,,,,,,,,,,,7_27_2020,,22105,,0.431585385,2,8/29/20 14:29,8/29/20 14:30,0,2,1,Smartphone,2,56,3,5,1,3,1,1,15,FL,3,5,0,1,1,1,2,4,0,0,0,0,4,0,0,0,0,0,0,0,0
A8K7U1,2020-08-29T12:26:57Z,,2,2,screener,No,No,No,No,No,No,,,,,,,,,,,,,,,,,,,0,,,,0,,,,0,,,,0,,,,0,,,,0,,,,,,,,,,,,,,,,,,,,,,,,,,,,,,,,,,,,,,,,,,,,,,,,,7_27_2020,,540,,0.146848249,2,7/31/20 22:01,8/29/20 11:28,0,2,1,Desktop,2,64,4,5,1,3,4,1,10,ID,4,8,1,1,2,3,4,1,0,0,0,0,1,0,0,0,0,0,0,0,0
E2L2X9,2020-08-29T12:21:54Z,,2,2,screener,No,No,No,No,No,Yes,,,,,,,,,,,,,,,,,,,0,,,,0,,,,0,,,,0,,,,0,,,,0,,,,,,,,,,,,,,,,,,,,,,,,,,,,,,,,,,,,,,,,,,,,,,,,,7_27_2020,,21532,,1.206212251,2,8/29/20 13:21,8/29/20 13:23,0,2,1,Smartphone,1,52,3,4,1,5,1,1,13,FL,3,5,1,1,1,1,4,2,0,0,0,0,2,0,0,0,0,0,0,0,0
N3Y8C7,2020-08-29T12:17:50Z,,2,2,screener,No,No,No,No,No,No,,,,,,,,,,,,,,,,,,,0,,,,0,,,,0,,,,0,,,,0,,,,0,,,,,,,,,,,,,,,,,,,,,,,,,,,,,,,,,,,,,,,,,,,,,,,,,7_27_2020,,27227,,1.705743605,2,8/29/20 14:17,8/29/20 14:18,0,2,1,Smartphone,2,25,1,2,1,3,1,1,9,PA,1,2,1,1,1,3,5,3,0,0,0,0,1,0,0,0,0,0,0,0,0
W3J2C5,2020-08-29T12:06:03Z,,2,2,screener,No,No,No,No,No,No,,,,,,,,,,,,,,,,,,,0,,,,0,,,,0,,,,0,,,,0,,,,0,,,,,,,,,,,,,,,,,,,,,,,,,,,,,,,,,,,,,,,,,,,,,,,,,7_27_2020,,20591,,0.546243762,2,8/29/20 14:05,8/29/20 14:06,0,2,1,Smartphone,2,35,2,3,1,4,1,7,16,NJ,1,2,1,1,2,3,4,3,0,0,0,0,3,0,0,0,0,0,0,0,0
L0M2I6,2020-08-29T12:04:09Z,,2,2,screener,No,No,No,No,No,No,,,,,,,,,,,,,,,,,,,0,,,,0,,,,0,,,,0,,,,0,,,,0,,,,,,,,,,,,,,,,,,,,,,,,,,,,,,,,,,,,,,,,,,,,,,,,,7_27_2020,,18599,,0.515978429,2,8/29/20 11:03,8/29/20 11:05,0,2,1,Desktop,2,71,4,6,1,3,3,5,11,CA,4,9,1,1,1,2,2,1,0,0,0,0,1,0,0,0,0,0,0,0,0
L7V4N8,2020-08-29T11:57:05Z,,2,1,no,No,Yes,Yes,No,,,5,2,5,1,5,1,0,1,0,0,0,2,0,1,2,0,1,1,0,,,,0,,,,0,,,,0,800,Thought I was going to rent a house and sent money to someone name Michael through Western Union for whatever,N,0,,,,0,,,,,,,,,,,,,,,,,,,,,,,,,,,,,,,,,,,,,,No,,,,,,,,,,,,,28276,,5.494985028,1,8/29/20 12:56,8/29/20 13:01,0,2,1,Smartphone,2,43,2,3,4,2,5,1,1,TX,3,7,1,1,2,1,4,4,0,1,0,0,3,0,0,0,0,0,0,0,0
P2U0C1,2020-08-29T11:35:01Z,,2,2,screener,No,No,Yes,No,No,Yes,,,,,,,,,,,,,,,,,,,0,,,,0,,,,0,,,,0,,,,0,,,,0,,,,,,,,,,,,,,,,,,,,,,,,,,,,,,,,,,,,,,,,,,,,,,,,,7_27_2020,,5285,,0.856898735,2,8/29/20 13:34,8/29/20 13:35,0,2,1,Smartphone,2,33,2,2,1,4,1,1,11,TN,3,6,1,1,1,1,4,4,0,1,1,0,2,0,0,0,0,0,0,0,0
S8H9A2,2020-08-29T10:43:12Z,,2,2,screener,No,No,No,No,No,No,,,,,,,,,,,,,,,,,,,0,,,,0,,,,0,,,,0,,,,0,,,,0,,,,,,,,,,,,,,,,,,,,,,,,,,,,,,,,,,,,,,,,,,,,,,,,,7_27_2020,,31467,,0.496953949,2,8/29/20 12:42,8/29/20 12:44,0,2,1,Smartphone,2,59,3,5,1,5,1,1,11,IN,2,3,0,1,1,1,3,4,0,0,0,0,4,0,0,0,0,0,0,0,0
X3L4I3,2020-08-29T10:40:27Z,,2,2,screener,No,No,Yes,No,No,No,,,,,,,,,,,,,,,,,,,0,,,,0,,,,0,,,,0,,,,0,,,,0,,,,,,,,,,,,,,,,,,,,,,,,,,,,,,,,,,,,,,,,,,,,,,,,,7_27_2020,,8178,,0.987664871,2,8/29/20 12:40,8/29/20 12:41,0,2,1,Smartphone,1,47,3,4,1,3,1,1,10,VA,3,5,1,1,2,3,2,2,0,0,0,0,2,0,0,0,0,0,0,0,0
D2A4E5,2020-08-29T10:29:31Z,,2,2,screener,No,No,No,No,No,No,,,,,,,,,,,,,,,,,,,0,,,,0,,,,0,,,,0,,,,0,,,,0,,,,,,,,,,,,,,,,,,,,,,,,,,,,,,,,,,,,,,,,,,,,,,,,,7_27_2020,,24041,,0.672248615,2,8/29/20 9:29,8/29/20 9:30,0,2,1,Desktop,2,59,3,5,1,4,4,1,17,CA,4,9,1,1,1,1,4,4,0,0,0,0,4,0,0,0,0,0,0,0,0
J1Z8W7,2020-08-29T10:27:51Z,,2,2,screener,No,No,No,No,No,Yes,,,,,,,,,,,,,,,,,,,0,,,,0,,,,0,,,,0,,,,0,,,,0,,,,,,,,,,,,,,,,,,,,,,,,,,,,,,,,,,,,,,,,,,,,,,,,,7_27_2020,,30292,,0.316416314,2,8/29/20 12:27,8/29/20 12:28,0,2,1,Smartphone,2,36,2,3,1,3,4,1,5,OH,2,3,1,1,2,1,4,6,0,4,6,2,3,0,0,0,0,0,0,0,0
J1A2G2,2020-08-29T10:24:02Z,,2,2,screener,No,No,No,No,,No,,,,,,,,,,,,,,,,,,,0,,,,0,,,,0,,,,0,,,,0,,,,0,,,,,,,,,,,,,,,,,,,,,,,,,,,,,,,,,,,,,,,,,,,,,,,,,7_27_2020,,17268,,0.410333432,2,8/29/20 11:23,8/29/20 11:26,0,2,1,Smartphone,2,57,3,5,1,3,1,7,4,AR,3,7,0,1,1,4,2,3,0,0,0,0,3,0,0,0,0,0,0,0,0
H0V6M8,2020-08-29T10:16:30Z,,2,2,screener,No,No,No,No,No,No,,,,,,,,,,,,,,,,,,,0,,,,0,,,,0,,,,0,,,,0,,,,0,,,,,,,,,,,,,,,,,,,,,,,,,,,,,,,,,,,,,,,,,,,,,,,,,7_27_2020,,15562,,1.386473802,2,8/29/20 12:16,8/29/20 12:17,0,2,1,Desktop,2,29,1,2,4,4,5,1,4,MA,1,1,1,1,2,3,4,6,0,0,0,0,7,0,0,0,0,0,0,0,0
B9I9M1,2020-08-29T10:09:09Z,,2,2,screener,No,No,No,No,No,No,,,,,,,,,,,,,,,,,,,0,,,,0,,,,0,,,,0,,,,0,,,,0,,,,,,,,,,,,,,,,,,,,,,,,,,,,,,,,,,,,,,,,,,,,,,,,,7_27_2020,,19906,,0.313269469,2,8/29/20 11:07,8/29/20 11:10,0,2,1,Desktop,2,70,4,6,1,3,1,1,7,IA,2,4,1,0,1,1,4,2,0,0,0,0,1,0,0,0,0,0,0,0,0
H1R4L0,2020-08-29T10:07:27Z,,2,2,screener,No,No,No,No,No,Yes,,,,,,,,,,,,,,,,,,,0,,,,0,,,,0,,,,0,,,,0,,,,0,,,,,,,,,,,,,,,,,,,,,,,,,,,,,,,,,,,,,,,,,,,,,,,,,7_27_2020,,8431,,1.250825972,2,8/29/20 12:07,8/29/20 12:08,0,2,1,Desktop,2,28,1,2,4,4,1,4,13,NY,1,2,1,1,2,3,4,2,0,0,0,0,2,0,0,0,0,0,0,0,0
D3V9E1,2020-08-29T09:42:16Z,,2,2,screener,No,No,No,No,No,Yes,,,,,,,,,,,,,,,,,,,0,,,,0,,,,0,,,,0,,,,0,,,,0,,,,,,,,,,,,,,,,,,,,,,,,,,,,,,,,,,,,,,,,,,,,,,,,,7_27_2020,,20778,,1.00168129,2,8/29/20 8:42,8/29/20 8:43,0,2,1,Desktop,2,42,2,3,1,4,3,1,11,OR,4,9,1,1,1,1,4,1,0,0,0,0,1,0,0,0,0,0,0,0,0
I4P3Q6,2020-08-29T09:38:43Z,,2,2,screener,No,No,No,No,,Yes,,,,,,,,,,,,,,,,,,,0,,,,0,,,,0,,,,0,,,,0,,,,0,,,,,,,,,,,,,,,,,,,,,,,,,,,,,,,,,,,,,,,,,,,,,,,,,7_27_2020,,23717,,1.37252972,2,8/29/20 11:38,8/29/20 11:39,0,2,1,Smartphone,2,36,2,3,1,1,5,1,4,MI,2,3,0,1,2,3,4,3,0,0,2,0,1,0,0,0,0,0,0,0,0
R6Q6R7,2020-08-29T09:05:13Z,,2,2,screener,No,No,No,No,No,No,,,,,,,,,,,,,,,,,,,0,,,,0,,,,0,,,,0,,,,0,,,,0,,,,,,,,,,,,,,,,,,,,,,,,,,,,,,,,,,,,,,,,,,,,,,,,,7_27_2020,,15613,,0.716230378,2,8/29/20 11:04,8/29/20 11:06,0,2,1,Smartphone,2,35,2,3,1,4,1,1,11,OH,2,3,1,1,1,1,4,6,0,3,2,0,2,0,0,0,0,0,0,0,0
V1S3P9,2020-08-29T09:00:25Z,,2,2,screener,No,No,No,No,No,Yes,,,,,,,,,,,,,,,,,,,0,,,,0,,,,0,,,,0,,,,0,,,,0,,,,,,,,,,,,,,,,,,,,,,,,,,,,,,,,,,,,,,,,,,,,,,,,,7_27_2020,,24046,,0.361483162,2,8/29/20 9:00,8/29/20 9:02,0,2,1,Desktop,1,69,4,6,1,4,5,5,11,WY,4,8,0,1,1,1,4,1,0,0,0,0,1,0,0,0,0,0,0,0,0
R6A1T8,2020-08-29T08:47:01Z,,2,2,inconsistent,No,Yes,No,No,No,Yes,4,4,5,1,1,1,0,1,0,0,0,0,0,0,1,0,0,0,0,,,,0,,,,0,,,,0,,,,0,,,,0,,,,,,,,,,,,,,,,,,,,,,,,,,,,,,,,,,,,,,,,,,,,,,,,,7_27_2020,,30337,,0.260624874,2,8/29/20 9:46,8/29/20 9:53,0,2,1,Desktop,1,67,4,6,1,3,1,5,11,MO,2,4,1,1,1,1,2,2,0,0,0,0,2,0,0,0,0,0,0,0,0
Y0K7M7,2020-08-29T08:44:27Z,,2,2,screener,No,No,,No,,,,,,,,,,,,,,,,,,,,,0,,,,0,,,,0,,,,0,,,,0,,,,0,,,,,,,,,,,,,,,,,,,,,,,,,,,,,,,,,,,,,,,,,,,,,,,,,7_27_2020,,15224,,0.229388933,2,8/19/20 9:45,8/29/20 10:57,20,2,1,Smartphone,2,67,4,6,1,3,3,5,9,MO,2,4,0,1,1,2,3,1,0,0,0,0,1,0,0,0,0,0,0,0,0
M8B0V9,2020-08-29T08:17:54Z,,2,2,screener,No,No,No,No,No,No,,,,,,,,,,,,,,,,,,,0,,,,0,,,,0,,,,0,,,,0,,,,0,,,,,,,,,,,,,,,,,,,,,,,,,,,,,,,,,,,,,,,,,,,,,,,,,7_27_2020,,26906,,0.229314884,2,8/29/20 9:17,8/29/20 9:18,0,2,1,Desktop,1,79,4,7,1,5,1,1,14,KS,2,4,1,1,1,1,4,2,0,0,0,0,2,0,0,0,0,0,0,0,0
L0Y6G1,2020-08-29T08:14:47Z,,2,2,screener,No,No,No,No,No,No,,,,,,,,,,,,,,,,,,,0,,,,0,,,,0,,,,0,,,,0,,,,0,,,,,,,,,,,,,,,,,,,,,,,,,,,,,,,,,,,,,,,,,,,,,,,,,7_27_2020,,15127,,0.715309907,2,8/29/20 9:14,8/29/20 9:15,0,2,1,Smartphone,2,37,2,3,1,4,5,1,8,OK,3,7,1,1,2,3,4,1,0,0,0,0,1,0,0,0,0,0,0,0,0
O1A7Y2,2020-08-29T08:04:21Z,,2,2,inconsistent,Yes,No,No,No,No,Yes,5,5,5,5,5,5,5,7,4,2,5,9,6,3,7,6,8,5,0,,,,0,,,,0,,,,0,,,,0,,,,0,,,,,,,,,,,,,,,,,,,,,,,,,,,,,,,,,,,,,,,,,,,,,,,,,7_27_2020,,11436,,0.388839679,2,8/29/20 10:03,8/29/20 10:08,1,2,1,Desktop,1,55,3,5,1,3,4,1,10,NY,1,2,0,1,2,1,4,2,0,0,0,0,2,0,0,0,0,0,0,0,0
T1U2U9,2020-08-29T07:53:29Z,,2,2,screener,No,No,No,No,,,,,,,,,,,,,,,,,,,,,0,,,,0,,,,0,,,,0,,,,0,,,,0,,,,,,,,,,,,,,,,,,,,,,,,,,,,,,,,,,,,,,,,,,,,,,,,,7_27_2020,,21626,,0.781096603,2,8/29/20 9:53,8/29/20 9:54,0,2,1,Desktop,2,62,4,5,1,2,1,7,9,TN,3,6,1,1,2,1,2,2,0,0,0,0,2,0,0,0,0,0,0,0,0
